submission,author,body,score,created,url_of_post
hzfilf,callmesnek,He looks like Kevin Flynn from Tron Legacy,146,1595951507.0,/r/xboxone/comments/hzfilf/gabe_newell_prefers_xbox_series_x_over/
hzfilf,TheRealMetroidMan,He is turning into a wizard with age,1325,1595952910.0,/r/xboxone/comments/hzfilf/gabe_newell_prefers_xbox_series_x_over/
hzfilf,InfiniteTrigger,"Damn, Gabe looks awesome! He's aging very well.",2088,1595946381.0,/r/xboxone/comments/hzfilf/gabe_newell_prefers_xbox_series_x_over/
hzfilf,badtaker22,Damn he looks healthier than ever,206,1595953758.0,/r/xboxone/comments/hzfilf/gabe_newell_prefers_xbox_series_x_over/
hzfilf,Autarch_Kade,"He's probably really happy seeing Xbox bring their games to Steam, including Master Chief Collection.  They're showering him with money.

I assume he also likes ease of development across multiple devices and operating systems - something that Steam has both pushed itself, and benefits from.

And Xbox is going to be the most powerful, unlike what you'd have guessed last Thursday.",1290,1595950853.0,/r/xboxone/comments/hzfilf/gabe_newell_prefers_xbox_series_x_over/
hzfilf,Cambridge_Carnage,"Tv host: “Which system is better, Xbox or PlayStation?”  Gabe: “Xbox.” Host: “why?” Gabe: “Because it is.”

Damn, no equivocation or qualification. It just is. I wish I could speak with such authority.",1413,1595950227.0,/r/xboxone/comments/hzfilf/gabe_newell_prefers_xbox_series_x_over/
hzfilf,holyshytte,what about ja rule?,422,1595947116.0,/r/xboxone/comments/hzfilf/gabe_newell_prefers_xbox_series_x_over/
hzfilf,freakblaze,"Defo a combo of beard and new glasses frame, makes him look fucking dope!",52,1595952278.0,/r/xboxone/comments/hzfilf/gabe_newell_prefers_xbox_series_x_over/
hzfilf,shocker3800,Would probably mean something if valve made games for the consoles any more.,173,1595947420.0,/r/xboxone/comments/hzfilf/gabe_newell_prefers_xbox_series_x_over/
hzfilf,devilfromjerseycity,He’s always been an Xbox guy. That’s why the orange box didn’t come to PS3 right away.,53,1595962397.0,/r/xboxone/comments/hzfilf/gabe_newell_prefers_xbox_series_x_over/
hzfilf,RealKevinJames,Probably happy MS is bringing games over to steam and PC,61,1595950749.0,/r/xboxone/comments/hzfilf/gabe_newell_prefers_xbox_series_x_over/
hzfilf,Gonra,"the change of the tone of the journalist...
""Whyyyyyyyy""",119,1595948297.0,/r/xboxone/comments/hzfilf/gabe_newell_prefers_xbox_series_x_over/
hzfilf,tmussenalt,ODIN IS WITH US,76,1595949824.0,/r/xboxone/comments/hzfilf/gabe_newell_prefers_xbox_series_x_over/
hzfilf,I_Have_3_Legs,Wow it wasn’t even a question for him. Xbox 100% and this is coming from the head of PCmaster race. Wish more pc players were this reasonable,181,1595947221.0,/r/xboxone/comments/hzfilf/gabe_newell_prefers_xbox_series_x_over/
hzfilf,branant221,"Just reading some of the comments , anything positive for Xbox get some people upset. And now Gabe Newell is not important or relevant anymore.  Just wow.",96,1595950681.0,/r/xboxone/comments/hzfilf/gabe_newell_prefers_xbox_series_x_over/
hzfilf,murphyspubowner,"Then he just stares off, so defeated. Hilarious",210,1595956566.0,/r/xboxone/comments/hzfilf/gabe_newell_prefers_xbox_series_x_over/
hzfilf,UncleDanko,"The hookers and blow for the party is of course not PG13 for that show, so he lied.",92,1595963114.0,/r/xboxone/comments/hzfilf/gabe_newell_prefers_xbox_series_x_over/
hzfilf,LoudMusic,"Yeah, don't ask ridiculously wealthy people what they're doing with their money. Super rude. You won't get a serious answer.",74,1595963476.0,/r/xboxone/comments/hzfilf/gabe_newell_prefers_xbox_series_x_over/
hzfilf,Because_Logic,He's just planning to pull a Halliday on us. If any company is gonna make an OASIS then it'll be Valve,339,1595960658.0,/r/xboxone/comments/hzfilf/gabe_newell_prefers_xbox_series_x_over/
hzfilf,ShambolicDisplay,"The weight loss, and beard growth really work well for him",987,1595946517.0,/r/xboxone/comments/hzfilf/gabe_newell_prefers_xbox_series_x_over/
hzfilf,Tincruures,Well being filthy rich having best food and medicare makes you aging well in most chases.,85,1595951301.0,/r/xboxone/comments/hzfilf/gabe_newell_prefers_xbox_series_x_over/
hzfilf,blinkingm,"Forget MCC, Halo Infinite page is up on Steam.",368,1595952128.0,/r/xboxone/comments/hzfilf/gabe_newell_prefers_xbox_series_x_over/
hzfilf,AllAlexi,"I mean it really should have gone...

Tv host: “Which system is better, Xbox or PlayStation?” Gabe: “Xbox.” Host: “why?” Gabe: “**Because they're putting all their games on Steam as well**.""",895,1595951026.0,/r/xboxone/comments/hzfilf/gabe_newell_prefers_xbox_series_x_over/
hzfilf,Dreadgoat,"Man there's a lot of cynics in here. This is what I think Gabe's thought process is:  

Xbox is basically a PC architecturally, which is good for developers who want to be multi-platform.  
Regardless of the above point, Gabe is a PC guy.  
Xbox has stronger hardware specs. It just does. There isn't really any way to argue this without going into crazy edge cases and hypotheticals (which people eagerly do).  
As a vendor or developer, working with MS is easier than working with Sony, in spite of the bad reputation MS has.  
He might just like Xbox exclusives more than PS exclusives, or *far more likely* that doesn't factor into his thought process at all.  

I say all this as someone who will be buying a PS5 at launch and passing on the Xbox. I have my own reasons (spoiler: it's demon's souls lmao) but it's pretty obvious from an objective standpoint why someone would say Xbox is a better machine without diving into their financial interests.",205,1595962308.0,/r/xboxone/comments/hzfilf/gabe_newell_prefers_xbox_series_x_over/
hzfilf,digita1catt,"See, the phrasing of the wording gets me. Gabe is a PC guy. When asked which one out of two systems is *better*, objectively, it *is* the Series X. Its the better console in terms of specs. I'm not so sure if that meant he prefers xbox to PlayStation outside of business partnerships.",79,1595955705.0,/r/xboxone/comments/hzfilf/gabe_newell_prefers_xbox_series_x_over/
hzfilf,BunnieSPH,"Where's Ja!?
I need to make sense of all this.",178,1595948804.0,/r/xboxone/comments/hzfilf/gabe_newell_prefers_xbox_series_x_over/
hzfilf,,"The only game outside MOBA that hasn't hit consoles in recent years recentfrom Valve is Half-Life: Alyx.

Well, that and the card game, but card games do not do well on console.",51,1595948239.0,/r/xboxone/comments/hzfilf/gabe_newell_prefers_xbox_series_x_over/
hzfilf,Re-toast,Ugh she sounded so awful,54,1595949128.0,/r/xboxone/comments/hzfilf/gabe_newell_prefers_xbox_series_x_over/
hzfilf,,Most of them are. It's just the dickheads on the internet that aren't,143,1595947536.0,/r/xboxone/comments/hzfilf/gabe_newell_prefers_xbox_series_x_over/
hzfilf,jacquetheripper,"Dont ask anyone that question, it's stupid and doesnt go anywhere.",103,1595967217.0,/r/xboxone/comments/hzfilf/gabe_newell_prefers_xbox_series_x_over/
hzfilf,dynamicj,"But not that Oasis from the movie, I'm talking OG Oasis from the book.",118,1595968500.0,/r/xboxone/comments/hzfilf/gabe_newell_prefers_xbox_series_x_over/
hzfilf,sonheungwin,Beards also make you look skinnier -- they hide the multiple chins really well.,224,1595958164.0,/r/xboxone/comments/hzfilf/gabe_newell_prefers_xbox_series_x_over/
hzfilf,black_flag_4ever,Holy shit. Just looking at his wiki page the change is significant.,134,1595950471.0,/r/xboxone/comments/hzfilf/gabe_newell_prefers_xbox_series_x_over/
hzfilf,RonnieJamesDionysos,"It's not expensive to not get fat, just eat less of your unhealthy cheap food. If you eat less, you also need less healthcare.",100,1595953739.0,/r/xboxone/comments/hzfilf/gabe_newell_prefers_xbox_series_x_over/
hzfilf,Freyaka,"Pretty much the entire games showcase was on steam immediately after the showcase (including flight sim, avowed, ect...) I have a gut feeling that is probably completely false, that within the next year, we'll see Game Pass as an available feature to steam and the Windows store will just basically migrate over from the store to steam for handling.

Could just be gas, I'm not known to be right very often lol.",140,1595955390.0,/r/xboxone/comments/hzfilf/gabe_newell_prefers_xbox_series_x_over/
hzfilf,bujweiser,"It's weird because he said he doesn't have a horse in the race with either system, but you'd think Microsoft's doing Valve a solid by releasing MCC on Steam.",94,1595959524.0,/r/xboxone/comments/hzfilf/gabe_newell_prefers_xbox_series_x_over/
hzfilf,lefty9602,Or he could go into teraflops blah blah blah,105,1595952157.0,/r/xboxone/comments/hzfilf/gabe_newell_prefers_xbox_series_x_over/
hzfilf,Camulus,The reason I'm buying a PS5 and not an Xbox is because I've already got a gaming PC that I'm upgrading to accommodate the next gen games. Thank you Microsoft for remembering your PC base.,57,1595969962.0,/r/xboxone/comments/hzfilf/gabe_newell_prefers_xbox_series_x_over/
hzfilf,chucktowski,I think Microsoft considers you a win/win scenario here. PC gamer? Awesome. Xbox gamer? Awesome.,66,1595950685.0,/r/xboxone/comments/hzfilf/gabe_newell_prefers_xbox_series_x_over/
hzfilf,Because_Logic,So do I. An OASIS which has boring school planets and corporate offices and brothels and supports haptic sex dolls because what's the point otherwise,80,1595968868.0,/r/xboxone/comments/hzfilf/gabe_newell_prefers_xbox_series_x_over/
hzfilf,cdts2192,Shhhh don't be givng away the secret.,133,1595958618.0,/r/xboxone/comments/hzfilf/gabe_newell_prefers_xbox_series_x_over/
hzfilf,CynicalCDN,I don't see why Microsoft would want to give up a cut of gamepass sales to Valve when the way they've got it now works perfectly fine.,89,1595956201.0,/r/xboxone/comments/hzfilf/gabe_newell_prefers_xbox_series_x_over/
hzfilf,Aviskr,"It's more than just MCC, pretty sure every game MS will be releasing for PC will come to steam, including Halo Infinite.",66,1595960543.0,/r/xboxone/comments/hzfilf/gabe_newell_prefers_xbox_series_x_over/
hzfilf,DetBabyLegs,I've been with my wife for 6 years. She'll never know how weak my jawline is because I've never not had a beard around her. *It's my little secret*.,55,1595971426.0,/r/xboxone/comments/hzfilf/gabe_newell_prefers_xbox_series_x_over/
hzfilf,Freyaka,"Because there is a ton of people who absolutely despise the windows store with a passion and will not use it, game pass or not.

Those same people swear that gaben is god and steam is perfection. Which hey, gabe is awesome and so is steam (though I'm fine with the windows store due to Game Pass)

It's all about expanding your market and Steam does allow them to expand that market by a large amount. No matter how good game pass on pc sales are now, Steam has far more exposure and loyalty.

Not to mention, there are games like Destiny 2 that currently cannot be included in the PC side of gamepass because of the Steam exclusivity at the moment.

It opens it up so that Steam games can be included in Gamepass which strengthens gamepass.",53,1595956532.0,/r/xboxone/comments/hzfilf/gabe_newell_prefers_xbox_series_x_over/
frp32n,ruslan74,Fully agree with this choice. Makes it easier to keep playing after simply swapping batteries.,3016,1585568033.0,/r/xboxone/comments/frp32n/microsoft_explains_why_xbox_series_x_controller/
frp32n,HMJebus,Huh. What about the Elite 2?,335,1585568668.0,/r/xboxone/comments/frp32n/microsoft_explains_why_xbox_series_x_controller/
frp32n,justdaman182,Now if they could start doing that with the Elite controllers again. Everything about the Elite V2 is better except for the battery being inside the controller.,402,1585572208.0,/r/xboxone/comments/frp32n/microsoft_explains_why_xbox_series_x_controller/
frp32n,NovusXXIII,"Less than $15 gets you an Energizer charging hub and 4 rechargeable AA batteries.  I never worry about dead batteries or charge and play kits or any of that.  Just rotate one set for the other when they get low, and the charging base shuts off when the batteries are at capacity so they just sit there waiting for you.",162,1585571251.0,/r/xboxone/comments/frp32n/microsoft_explains_why_xbox_series_x_controller/
frp32n,davidlpool1982,"I'm one of those glad that they've kept the battery option. Lets be honest though, I imagine it's more cost control and to get people to buy Play & Charge kits. Absolutely no shame in that either, it allows people to buy the console for a little cheaper and then buy the P&C kit later when they have the cash. Good for retail attatchment rates too.",140,1585569993.0,/r/xboxone/comments/frp32n/microsoft_explains_why_xbox_series_x_controller/
frp32n,DbrownOG27,They could have just included two rechargeable battery packs and a dock for them to charge on. This way there’s flexibility and I’m not spending money on batteries,52,1585576455.0,/r/xboxone/comments/frp32n/microsoft_explains_why_xbox_series_x_controller/
frp32n,zachzwp,If they truly cared about giving players flexibility they would just include a batter pack that you could choose to use or not instead of charging people for it afterwards. It is ridiculous that the Xbox controllers cost the same as the PS controllers but You need to buy extra items to make the Xbox controller work.,89,1585573915.0,/r/xboxone/comments/frp32n/microsoft_explains_why_xbox_series_x_controller/
frp32n,bodnast,Agreed. My XB1 controller battery pack that I bought 6 years ago easily lasts 12+ hours of use. My Dualshock 4 controller lasts about 3 hours before I have to plug it in,1165,1585576779.0,/r/xboxone/comments/frp32n/microsoft_explains_why_xbox_series_x_controller/
frp32n,Countdown3,"Came here to say the same thing. Personally I'm not happy the Elite 2 has a built in battery. I rather the option to just throw in my rechargeable AA's. Yeah, the Elite 2 battery life is great now, but will I be able to say the same in 2-years?",252,1585572032.0,/r/xboxone/comments/frp32n/microsoft_explains_why_xbox_series_x_controller/
frp32n,Btrips,that's what I love most about it. After I play I just pop it onto the built in charger in the case and I never have to worry about it.,138,1585572862.0,/r/xboxone/comments/frp32n/microsoft_explains_why_xbox_series_x_controller/
frp32n,DarthWaq,Eneloops 2500mah!!!,57,1585576611.0,/r/xboxone/comments/frp32n/microsoft_explains_why_xbox_series_x_controller/
frp32n,ziggy_the_starman,"It's not because they cared, people. It's cheaper to make controllers without a lithium battery",51,1585576986.0,/r/xboxone/comments/frp32n/microsoft_explains_why_xbox_series_x_controller/
frp32n,I_TRS_Gear_I,"I hate to draw comparisons between consoles here, but you’re right. I simply don’t understand why Microsoft has to justify their decision to make there controller have removable batteries. 

Batteries degrade over time, and having one inside the controller that cannot be removed without a screwdriver is just silly. I hate playing with a cable on my controller. If my rechargeable batteries die in the middle of a session I just swap them out for another set and keep on playing. DS4 honestly have like 3-4 hour batter life right outside the box. The choice to have removable batteries is a no brainer.",917,1585577723.0,/r/xboxone/comments/frp32n/microsoft_explains_why_xbox_series_x_controller/
frp32n,Hazza42,"That’s the tradoff I suppose. Better battery life than your typical AAs when new, but worse battery life at some point in the future. I’m guessing for most people though, who leave their controller on it’s charging dock most nights, battery life will never be an issue. 

My guess is that by the time the battery can’t even hold a days charge, the rest of the controller will be completely worn out and in need of replacement anyway.",59,1585573682.0,/r/xboxone/comments/frp32n/microsoft_explains_why_xbox_series_x_controller/
frp32n,justdaman182,"but when that battery dies, you're SOL. With the option, you could have it your way OR you could replace the batteries if you prefer. The  plus side about having the option is that when your rechargeable batteries can no longer hold a charge you can replace it for new rechargeable batteries. In it's current form you can only replace the controller...$179.99",107,1585574643.0,/r/xboxone/comments/frp32n/microsoft_explains_why_xbox_series_x_controller/
frp32n,ithinkmynameismoose,They ‘have’ to justify it because some idiots only look at the ‘new features’ lost to determine the quality of a new product.,369,1585579253.0,/r/xboxone/comments/frp32n/microsoft_explains_why_xbox_series_x_controller/
frp32n,Xearoii,If the battery dies theirs a damn 20 ft USB cord with this set lol,51,1585575743.0,/r/xboxone/comments/frp32n/microsoft_explains_why_xbox_series_x_controller/
frp32n,johnmark69,"Xbox elite series 2 batteries last for 30 hours, ps4 controller batteries last 4-5 at most.

There is a big difference.",73,1585579927.0,/r/xboxone/comments/frp32n/microsoft_explains_why_xbox_series_x_controller/
frp32n,zero_the_clown,Yeah I'm not paying almost $200 for a wired pad lmao,60,1585576731.0,/r/xboxone/comments/frp32n/microsoft_explains_why_xbox_series_x_controller/
frp32n,Str8knightmare,I have rechargeable AA batteries in my Xbox one controller and they're old. They still last 2 full days with some light video watching and maybe about 6 hrs of gaming. Amazing decision Microsoft.,94,1585586199.0,/r/xboxone/comments/frp32n/microsoft_explains_why_xbox_series_x_controller/
frp32n,donkeykong95,"I’ve had the same 2 pairs of rechargeable AA batteries since launch. They hold at least 6 hour charge before I swap the other set in. Beauty of it, I’ve never had to plug my controller in once since launch.",50,1585590989.0,/r/xboxone/comments/frp32n/microsoft_explains_why_xbox_series_x_controller/
j6fq03,Lessiarty,"Microsoft are probably having a word with the originator of the report then if the embargo is that tight. If Tom isn't allowed to refute it, I doubt there was room to report it either.

Frustrating for all parties, I imagine.",1177,1602026203.0,/r/xboxone/comments/j6fq03/tom_warren_senior_editor_at_the_verge_about_the/
j6fq03,cjeagle,"There is a reason MS decided to adapt a PC tower form factor for the Xbox Series X and one of those is the simple but efficient cooling option it will provide with just a single 130 mm exhaust fan. 

It sounds to me like the cooling system is just doing it's job.",661,1602037532.0,/r/xboxone/comments/j6fq03/tom_warren_senior_editor_at_the_verge_about_the/
j6fq03,DanielG165,"I mean, it’s a very powerful system that produces a ton of energy inside of a very compact casing; it’s obvious that it will produce a good amount of heat. Plus, the Series X has what, like a 300 watt PSU? Microsoft has most definitely tested this console rigorously, and designed it specifically for the purposes of cooling, as seen by the split motherboard design, and the design of the box itself.  

These are high powered components, they will produce a ton of heat, it’s just the way it is. And, it sounds to me like the cooling solution is doing its job if that much heat is being exhausted, rather than it remaining inside of the system. I’d rather have a console run hotter, especially with how much performance it’s packing, and it still run silent, than one that’s loud and noisy. 

Oh, and the external SSD getting hot? Like, yeah, SSDs get pretty hot. It’d be like touching a bare internal NVME; the things are hot. It’s normal, this is honestly a non issue, and I’m still very much excited for my Series X to arrive hopefully on launch day.",580,1602028836.0,/r/xboxone/comments/j6fq03/tom_warren_senior_editor_at_the_verge_about_the/
j6fq03,nikrolls,It's similar to people commenting about the heat that the Microsoft Surface gives off (though I realise the use case is different): giving off heat under load is actually a good sign; doing all this intensive work *without* giving off heat means the heat (which is just physically impossible to avoid) is staying inside the device and frying the internals.,97,1602034963.0,/r/xboxone/comments/j6fq03/tom_warren_senior_editor_at_the_verge_about_the/
j6fq03,stopkillingmeplz,"If you understand the design of the console and the reality of cooling over 15 billion transistors given that design then you already assumed the Series X would run warmer than the One X. Go back and watch the videos from Digital Foundry when they went to Microsoft to preview the hardware layout and you'll see the design from top to bottom took heat concerns into consideration. It's the reality of computing in 2020. It's telling that days after folks were describing how quiet the Series X is people want to create a controversy in bad faith out of nothing based on a ""report"" from a journalist that doesn't know the first thing about computer hardware (but plenty about hyperbole).",237,1602027544.0,/r/xboxone/comments/j6fq03/tom_warren_senior_editor_at_the_verge_about_the/
j6fq03,Funky427,Half the console is a fucking heat sync vapor chamber and it has a big fucking fan on the top. It's not overheating.,66,1602042308.0,/r/xboxone/comments/j6fq03/tom_warren_senior_editor_at_the_verge_about_the/
j6fq03,afellowpadawan,"This sums up pretty much the whole discussion, and though what he says is pretty obvious, this cold war bs through fanboys, haters, the media, it really needs to stop. It's disgusting.

EDIT: I really didn't expect this to blow up this way, thank you kind redditors for these awards (though I don't know what to do with that xD). Now, for some comments around here:

- I don't think it's even remotely fair to say that it's very possible because of what happened with the 360, taking into account the 14 years of experience that separate them. Nevertheless, of course you never know, but to suspect it this aggressively at this point, it feels shady.
- It's easy to draw conclusions when it fits your narrative, but the best way to approach the truth is to study the subject. Get some info on how hardware works, how the system is built, and you'll probably change your mind one way or another, just don't spread rumours without the necessary understanding.
- Yes, it's also possible that PS5 might have some problems as well, but I won't play that game from neither side. 
- Apparently the one who started this bs works for a media strongly sponsored by Sony, again it could be only because of pure ignorance, but at this point, given what I've seen on the internet, I expect nothing and am disappointed anyway.
- I really have no knowledge about this guy or The Verge, I just saw it on my timeline and found it to be a good abstract. I think the same, and thought it would be an interesting thought to share, knowing that people would be more open to discussion if coming from him than from me posting here.",52,1602025793.0,/r/xboxone/comments/j6fq03/tom_warren_senior_editor_at_the_verge_about_the/
j6fq03,SonsOfZadok,I think they had to pull the statment down.,205,1602031411.0,/r/xboxone/comments/j6fq03/tom_warren_senior_editor_at_the_verge_about_the/
j6fq03,Steakpiegravy,"Microsoft is so proud of their console being reliable they had no issues sending it to hundreds of influencers. They just didn't count on some of them being so ignorant about hardware that they would be creating these stupid rumours likely before speaking to Microsoft.  

I just don't understand what they were thinking. Before they went online to do this, they should have spoken with Microsoft about it. They would have explained it's normal and likely also why - the console has the highest clocked CPU in a console to date at 3.8GHz and a GPU clock at 1.8GHz that only the PS5 has higher at 2.23GHz. 

Therefore, it shouldn't be surprising for really hot air to come out of Series X, because that means the cooling system is doing its job and not keeping the heat inside. The most impressive thing about it is that the console does this with a single fan and is incredibly quiet while doing so.

Edit for clarification: When you're dealing with stuff like this in the press, it's normal to be in touch with a PR guy from a company to talk over any issues. It's just standard procedure so that the company is aware of any issues of units out in the wild.",326,1602060031.0,/r/xboxone/comments/j6fq03/tom_warren_senior_editor_at_the_verge_about_the/
j6fq03,lindsaminds,"If you think Microsoft is going to put themselves in another RROD  situation, you're beyond help.  Companies don't make that kind of  mistake twice.",83,1602062822.0,/r/xboxone/comments/j6fq03/tom_warren_senior_editor_at_the_verge_about_the/
j6fq03,MC_chrome,"I’m going to guess that some people feel like the Series X will have the same problems as Apple’s trashcan Mac Pro, due to the cooling ideas being similar. Just a theory, though I may be wrong.",137,1602047728.0,/r/xboxone/comments/j6fq03/tom_warren_senior_editor_at_the_verge_about_the/
j6fq03,Trillbles,"All hardware produces heat, that's just the reality of it, not sure what people are expecting",231,1602032897.0,/r/xboxone/comments/j6fq03/tom_warren_senior_editor_at_the_verge_about_the/
j6fq03,MonsterHunter6353,microsoft clearly learned their lesson about heating problems ater the xbox 360's red ring of death so i highly doubt that theyd ever make that mistake again so i dont know what people were expecting,71,1602040837.0,/r/xboxone/comments/j6fq03/tom_warren_senior_editor_at_the_verge_about_the/
j6fq03,mastermalak84,Jez Corden sorta answered this on the podcast he does ever Friday. He stated that the sides and plastic felt nominal and not really even warm to touch and the top you definitely would feel warm air coming out but not scorching.,77,1602030619.0,/r/xboxone/comments/j6fq03/tom_warren_senior_editor_at_the_verge_about_the/
