permalink,url,title,num_comments,score,author,selftext,created
/r/xboxone/comments/e9xirg/xbox_series_x_world_premier_4k_trailer/,https://www.youtube.com/watch?v=0tUqIHwHDEc,Xbox Series X - World Premier - 4K trailer,7680,48303,Turbostrider27,,1576203178.0
/r/xboxone/comments/f8srmx/cd_projekt_red_on_twitter_gamers_should_never_be/,https://twitter.com/CyberpunkGame/status/1231961469669068800,"CD Projekt Red on Twitter - ""Gamers should never be forced to purchase the same game twice or pay for upgrades. Owners of #Cyberpunk2077 for Xbox One will receive the Xbox Series X upgrade for free when available.""",1286,32270,The_Iceman2288,,1582557857.0
/r/xboxone/comments/iyvqn8/xbox_uk_how_to_upgrade_games_on_xbox_series_x_s/,https://i.redd.it/5l1g0omi33p51.png,Xbox UK: how to upgrade games on Xbox Series X | S with Smart Delivery,965,25161,vicesam,,1600948228.0
/r/xboxone/comments/hmyrtr/xbox_has_told_developers_that_they_cannot_charge/,https://www.videogameschronicle.com/news/next-gen-game-upgrades-should-be-free-xbox-tells-developers/,"Xbox has told developers that they cannot charge players to upgrade their current-gen games to Xbox Series X versions as DLC, as an alternative to its free Smart Delivery scheme.",1136,22280,Turbostrider27,,1594142352.0
/r/xboxone/comments/es51ev/xbox_series_x_prototype_leaked/,https://i.redd.it/gizj55znl8c41.jpg,Xbox Series X prototype LEAKED.,2383,18890,TyphoonBoomW,,1579658319.0
/r/xboxone/comments/ipfgcb/xbox_series_s_and_xbox_series_x_launch_november/,https://www.reddit.com/r/xboxone/comments/ipfgcb/xbox_series_s_and_xbox_series_x_launch_november/,"Xbox Series S and Xbox Series X Launch November 10, Starting at $24.99 a Month with Xbox Game Pass Ultimate and EA Play",3114,18307,majornelson,"In addition to the traditional option of purchasing the new generation of Xbox Series X and S at $499 (Estimated Retail Price) and $299 (Estimated Retail Price) respectively, we’re expanding our Xbox All Access program to 12 countries this holiday, with more to come in 2021.

 [https://news.xbox.com/en-us/2020/09/09/xbox-series-x-and-xbox-series-s-launching-november-10/](https://news.xbox.com/en-us/2020/09/09/xbox-series-x-and-xbox-series-s-launching-november-10/)",1599656544.0
/r/xboxone/comments/ibeimy/if_selling_more_consoles_than_sony_and_nintendo/,https://www.reddit.com/r/xboxone/comments/ibeimy/if_selling_more_consoles_than_sony_and_nintendo/,"“If [selling more consoles than Sony and Nintendo] was our approach, we wouldn’t put our games on PC,” Spencer said. “We wouldn’t put our games on Xbox One, we wouldn’t do xCloud and allow people to play games on their phones.”",1843,18173,DarkTanicus,"[LINK] (http://
https://www.vg247.com/2020/08/16/phil-spencer-microsoft-xbox-series-x/)


EDIT : Wow! didn't expect this to blow up as it did. Salute for the awards, comments and the votes.",1597672314.0
/r/xboxone/comments/gkxvt2/made_this_halo_themed_xbox_series_x_ident/,https://v.redd.it/4xxvxfwcp5z41,Made this Halo themed Xbox series X ident.,299,14541,Belive_its_butter,,1589647860.0
/r/xboxone/comments/hzfilf/gabe_newell_prefers_xbox_series_x_over/,https://www.youtube.com/watch?v=BVjPUExAqaY,Gabe Newell prefers Xbox Series X over PlayStation 5,2066,13249,harushiga,,1595946122.0
/r/xboxone/comments/frp32n/microsoft_explains_why_xbox_series_x_controller/,https://www.eurogamer.net/articles/digitalfoundry-2020-constructing-xbox-series-x-a-revolution-in-console-design,"Microsoft Explains Why Xbox Series X Controller Still Uses Batteries: ""It’s all about giving players options and being flexible""",1865,13136,Frocharocha,,1585567774.0
/r/xboxone/comments/j6fq03/tom_warren_senior_editor_at_the_verge_about_the/,https://i.redd.it/lpjm2vv63kr51.jpg,"Tom Warren, Senior Editor at The Verge, about the Xbox Series X heat rumor.",746,12820,afellowpadawan,,1602025632.0
/r/xboxone/comments/iva5ws/xbox_series_x_showing_up_in_stores/,https://i.redd.it/sixgzl81vxn51.jpg,Xbox Series X showing up in stores,492,12483,AS_Empire,,1600449006.0
/r/xboxone/comments/h9i9k0/xbox_series_x_buy_a_game_once_and_play_the_best/,https://news.xbox.com/en-us/2020/06/15/what-is-smart-delivery-xbox-series-x/,Xbox Series X: Buy A Game Once and Play the Best Version Across Generations with Smart Delivery - Xbox Wire,850,11272,The_Iceman2288,,1592234067.0
/r/xboxone/comments/ea6ebx/xbox_series_x_to_allow_suspend_and_resume_for/,https://wccftech.com/xbox-series-x-to-allow-suspend-and-resume-for-multiple-games-at-once/,Xbox Series X to Allow 'Suspend and Resume' for Multiple Games at Once,815,11248,coolerthanice,,1576255538.0
/r/xboxone/comments/eky5vy/xbox_series_x_soc/,https://i.redd.it/fei3lk25d7941.png,Xbox Series X SOC,704,11130,onkel_axel,,1578335813.0
/r/xboxone/comments/ggje74/xbox_series_xs_ssd_enabling_instant_transition_to/,https://i.imgur.com/c0dCeMi.gifv,Xbox Series X's SSD enabling instant transition to an alternate world in The Medium (next-gen only game),954,11068,Focus_flimsy,,1589044562.0
/r/xboxone/comments/hlud9a/xbox_series_x_dashboard_after_your_feedback/,https://i.redd.it/lbwwpzsqt3951.gif,Xbox Series X Dashboard after your feedback,470,10737,Scarmander,,1593983673.0
/r/xboxone/comments/j1nomb/did_anyone_else_notice_the_live_wallpaper_on_the/,https://v.redd.it/18jq3ih35zp51,Did anyone else notice the live wallpaper on the Series X!? One of the few things that PlayStation has had that I’ve always wanted on Xbox.,469,10441,Champ9889,,1601336270.0
/r/xboxone/comments/flukqt/unlike_ps5_xbox_series_x_will_support_all_xbox/,https://www.vg247.com/2020/03/20/xbox-series-x-backwards-compatibility/amp/?__twitter_impression=true,"Unlike PS5, Xbox Series X will support all Xbox One games, says Microsoft",1002,10410,AS_Empire,,1584709032.0
/r/xboxone/comments/iqnpqq/xbox_series_x_xbox_series_s_and_the_rtx_3080_size/,https://i.redd.it/xkadqnm5thm51.jpg,"Xbox Series X, Xbox Series S and the RTX 3080 size comparison.",825,9859,MBHYAT,,1599818869.0
/r/xboxone/comments/fl9enn/xbox_used_master_chief_to_promote_series_x/,https://v.redd.it/rti8q5vjkmn41,Xbox used Master Chief to promote Series X yesterday,255,9812,Frocharocha,,1584621778.0
/r/xboxone/comments/j2f6ce/in_case_you_missed_it_the_elder_scrolls_online/,https://i.redd.it/6ai5v6ybn7q51.jpg,In case you missed it: The Elder Scrolls Online and Doom Eternal will receive free Optimized for Xbox Series X|S updates.,351,9108,XboxTakingWs,,1601439170.0
/r/xboxone/comments/j4ggk0/microsoft_is_unlocking_nearly_200_games_on_xbox/,https://twitter.com/tomwarren/status/1312315639953002498?s=20,Microsoft is unlocking nearly 200 games on Xbox Series X preview units this weekend. We might be able to see more preview vids from DF or other Youtubers,534,8804,bjki1107,,1601737312.0
/r/xboxone/comments/hi6jqd/this_morning_over_on_rxbox_a_guy_asked_for_a_bmo/,https://i.redd.it/icn10r4wfw751.png,"This morning over on r/Xbox a guy asked for a BMO Xbox Series X, this is what i came up with! Hope you guys like it too!!",214,8707,HoM4R_,,1593458232.0
/r/xboxone/comments/iyc9gl/xbox_series_x_is_currently_number_one_on_amazons/,https://i.redd.it/qvhaoxe81xo51.jpg,Xbox Series X is currently number one on Amazon's best sellers list in nine countries.,626,8593,117master_yoda,,1600874819.0
/r/xboxone/comments/eaadee/imitation_is_the_sincerest_form_of_flattery/,https://i.redd.it/ucb261a90h441.png,Imitation is the sincerest form of flattery. Wendy's Canada getting in on the XBox Series X Fun. :),225,8477,SotaSkoldier,,1576273315.0
/r/xboxone/comments/fm3lge/correction_to_date_weve_spent_over_100k_hours/,https://twitter.com/Xbox/status/1241111301851615232?ref_src=twsrc%5Etfw%7Ctwcamp%5Etweetembed%7Ctwterm%5E1241111301851615232&ref_url=https%3A%2F%2Fs9e.github.io%2Fiframe%2F2%2Ftwitter.min.html%231241111301851615232,"Correction: To date, we’ve spent over 100K hours testing your favorite games from Xbox One, including existing backward compatible 360 & OG Xbox games, on Xbox Series X. While we are still in the process of validating, we can confirm thousands of games will be playable at launch.",732,8436,GravityBrywn,,1584741383.0
/r/xboxone/comments/ebkspm/microsoft_confirmed_to_business_insider_the/,https://www.businessinsider.com/microsoft-only-using-xbox-name-going-forward-2019-12,"Microsoft confirmed to Business Insider. The next-generation Xbox consoles are actually just named ""Xbox,"" starting with the Xbox Series X.",1065,8421,bjki1107,,1576528714.0
/r/xboxone/comments/hq1yry/the_official_xbox_series_x_box_art/,https://i.redd.it/gii4krv7qha51.jpg,The Official Xbox Series X box art.,548,8412,Kim_Woo,,1594587638.0
/r/xboxone/comments/isyhow/xbox_series_x_s_power_your_dreams/,https://i.redd.it/ly02xztpo7n51.jpg,Xbox Series X | S. Power your dreams.,570,7897,ronbag,,1600132089.0
/r/xboxone/comments/fa0777/microsofts_xbox_series_x_will_be_able_to_resume/,https://www.theverge.com/2020/2/26/21154897/microsoft-xbox-series-x-resume-games-reboot-features-ray-tracing-audio,Microsoft’s Xbox Series X will be able to resume games even after a reboot,455,7768,Hex_of_Void,,1582750962.0
/r/xboxone/comments/iwour0/unpopular_opinion_we_need_to_unify_all_xbox/,https://www.reddit.com/r/xboxone/comments/iwour0/unpopular_opinion_we_need_to_unify_all_xbox/,Unpopular Opinion: We need to unify all Xbox subreddits into one,552,7761,WyldeGi,"There have been so many subreddits made for the next gen consoles, like r/XboxSeriesX, r/SeriesXbox, r/XboxSeriesXlS, r/Xbox_One_X, r/XboxNews, etc.

It’s gotten to the point where a ton of the next gen Xbox’s hype have been spread very thin, and in the long run I don’t think thats the best idea. We need to find one subreddit for everyone to actually engage in, rather than several if we want the community to engage at its peak.

Take r/PS5 for example. All the next gen console information is just on that one subreddit. Yes, it might be because of their simple naming scheme, but I feel like we can still find one community to channel all Xbox subreddits into.

PlayStation has a different strategy towards naming their communities. r/PlayStation is like an umbrella community that spans over all their consoles, and r/PS4 and r/PS5 are more specific under it. In my opinion, we should have it like that on Xbox too. r/Xbox as the umbrella (Even though I’ve heard that the moderators there aren’t the best), and a community that includes the next gen consoles, without being too specific.

Lemme know your thoughts, and whether I’m overexaggerating or not!",1600644435.0
/r/xboxone/comments/fbttjh/help_a_mum_out_please/,https://www.reddit.com/r/xboxone/comments/fbttjh/help_a_mum_out_please/,"Help a mum out, please?",590,6698,nicskoll,"Hi, I'm hoping to upgrade my son's xbox one to an xbox one x for his upcoming birthday. Do I need to buy new controllers and hdmi cables, or will they be compatible with the new console? I'm not a gamer, and don't know who to ask. Thanks for your help.

Edit: thank you all so much for being so bloody excellent! You're a fantastic community.

Final edit: THANK YOU. THANK YOU. THANK YOU. You're all amazing. My boy has chosen to wait for the series x, as you've all advised. Thank you for your help and advice. To those saying I'm a great mum, thank you, but I'm honestly just trying to encourage all of his hobbies, including this one. Platinum? Silver? Wow! You guys are just brilliant, thank you! In addition to all of this wholesomeness and kindness, we were also gifted EA access for a year. I'm in awe of you all. Sorry I can't respond to each reply, theres just so many of them, hence this edit.",1583068164.0
/r/xboxone/comments/hb3kok/phill_spencer_drops_a_bomb_on_twitter_confirms/,https://twitter.com/XboxP3/status/1273381292642463744?s=19,"Phill Spencer drops a bomb on twitter, confirms that the Xbox Series X will NOT ship with a HDMI sticker. #TeamNoSticker",604,6674,welshdragon888,,1592439130.0
/r/xboxone/comments/fk8tau/bring_your_favorite_games_with_you_to_xbox_series/,https://twitter.com/Xbox/status/1239960671170646016,Bring your favorite games with you to Xbox Series X! Simply connect your existing external USB hard drive to Xbox Series X and your entire library is instantly accessible.,498,6401,Frocharocha,,1584464698.0
/r/xboxone/comments/hk4k4l/xbox_series_x_and_ps5_games_at_70_xbox_game_pass/,https://www.windowscentral.com/xbox-series-x-playstation-5-70-dollar-games,"Xbox Series X and PS5 games at $70, Xbox Game Pass becomes even more valuable",1142,6049,Turbostrider27,,1593721128.0
/r/xboxone/comments/hfnl2v/xbox_series_x_optimized_for_xbox_series_x_trailer/,https://www.youtube.com/watch?v=JE3WolFKkYo,Xbox Series X - Optimized for Xbox Series X Trailer,746,5977,Turbostrider27,,1593097289.0
/r/xboxone/comments/gh9dse/fable_needs_to_be_the_xbox_series_xs_breath_of/,https://gamerant.com/fable-xbox-series-x-rumors-leaks-zelda-breath-wild/,Fable Needs to Be the Xbox Series X's Breath of the Wild,680,5941,SnoozeDoggyDog,,1589144071.0
/r/xboxone/comments/gvqzo1/microsoft_japan_confirms_2020_holiday_release_of/,https://twitter.com/famitsu/status/1268105219407114241?ref_src=twsrc%5Etfw%7Ctwcamp%5Etweetembed%7Ctwterm%5E1268109072458412032&ref_url=https%3A%2F%2Fs9e.github.io%2Fiframe%2F2%2Ftwitter.min.html%231268109072458412032,Microsoft Japan confirms 2020 holiday release of Xbox Series X for Japan.,242,5445,StrangerInPorto,,1591177731.0
/r/xboxone/comments/gjz8t6/halo_infinite_officially_confirmed_for_julys_xbox/,https://www.gamespot.com/articles/halo-infinite-officially-confirmed-for-julys-xbox-/1100-6477302/,Halo Infinite Officially Confirmed For July's Xbox Series X Reveal Event,693,4937,Sputniki,,1589504190.0
/r/xboxone/comments/ix1548/fuck_it_im_going_to_cancel_my_ps5_pre_order_get_a/,https://www.reddit.com/r/xboxone/comments/ix1548/fuck_it_im_going_to_cancel_my_ps5_pre_order_get_a/,Fuck it. I’m going to cancel my PS5 pre order get a Xbox Series X this time around.,825,4434,stadiofriuli,"Not only will the better GPU come in handy in the future but also is Game Pass the absolute best deal in gaming history. Fuck me sideways all MS IPs, plus Bethesda and id Software and on top of that EA Play. The few real PS exclusives I can actually do without. Most of the games that were announced and got me interested are timed exclusives anyway like Godfall, Project Athia and Kena. Game Pass will keep me busy until they release.

E. This is no dig at PS or Sony like at all, I just will go with MS this time as the offer is just way too good, probably get a PS5 somewhen later, in a few years.

E2. As this blew up a bit. No guys I’m not working for MS, not affiliated with either company, also not Phil Spencer. Just a gamer sharing his excitement. 

E3. I had a PS4 Pro, loved it and played all the exclusives, to those who’re worried I missed out.

E4. For the guys doubting that I pre ordered a PS5 in first place. https://i.imgur.com/CvvJnfL.jpg

E5. Thanks for all the awards, most important thing though is that I saw some real mature and interesting discussions take place inside this post.

Good luck for tomorrow lads!

And the Xbox Series X pre order is up. It went out of stock within minutes on Amazon. Luckily I got my hands on one.",1600697417.0
/r/xboxone/comments/f93urc/ibms_110_million_supercomputer_from_2001_had/,https://twitter.com/ZhugeEX/status/1231994961178087425?s=19,IBM's $110 million supercomputer from 2001 had roughly the same amount of computing power as Xbox Series X.,300,4409,JP76,,1582601465.0
/r/xboxone/comments/gyzb06/xbox_series_x_readies_for_a_pandemic_launch/,https://www.bbc.com/news/technology-52961835,Xbox Series X readies for a pandemic launch,673,4228,Turbostrider27,,1591622819.0
/r/xboxone/comments/ipg4z9/microsoft_has_confirmed_the_xbox_series_s_uses/,https://twitter.com/tomwarren/status/1303684256229658625?s=20,"Microsoft has confirmed the Xbox Series S uses the same CPU as the Xbox Series X running at 3.6GHz. Yes, the Xbox Series S CPU is faster than the PS5",1193,4102,catattaro,,1599659057.0
/r/xboxone/comments/gqrqlj/xbox_series_x_preorder_page_has_been_created_on/,https://www.microsoft.com/en-us/p/xbox-series-x/8wj714n3rbtl?cid=msft_web_collection,Xbox Series X Pre-Order Page Has Been Created on The Official MS Website.,681,3943,bjki1107,,1590474529.0
/r/xboxone/comments/gtmw0k/xbox_series_x_box_art/,https://i.redd.it/zqh4l1fl6z151.jpg,Xbox Series X box art,208,3659,WenzHouse,,1590876330.0
/r/xboxone/comments/hbcnsi/xbox_series_x_cyberpunk_2077_version/,https://i.redd.it/fp6fv3n1zi551.jpg,Xbox Series X Cyberpunk 2077 Version,153,3607,RWBY2,,1592478842.0
/r/xboxone/comments/7takg3/monster_hunter_world_can_we_appreciate_for_a/,https://www.reddit.com/r/xboxone/comments/7takg3/monster_hunter_world_can_we_appreciate_for_a/,"[Monster Hunter: World] Can we appreciate for a minute that PS4 got 3 Beta's, while Xbox got none, and all of our multiplayer options are completely broken because of it.",607,3532,Decoraan,"Ive been waiting for a MH on consoles since the PS2 days, over a decade. But im not pissed off about this for me (thankfully playing with friends works ok, even with the cutscene nonsense), im pissed off for the first time experiences people are having with this series on an Xbox.

Exclusives betas should never be a thing. Especially not if your going to fuck up the launch on the console that you dont test.

Edit: Private lobbies do work, its matchmaking and generally doing stuff that doesnt involve inviting people into a private lobby that doesnt work. People are saying that PS4 is having issues as well, but from what i can tell they aren't anywhere near as bad as the problems on Xbox.

Edit 2: As this has gotten a lot of attention I want to also point out that this game is absolutely amazing. With lots of people in this subreddit asking for a JRPG I would say to absolutely take the dive. It’s one of the most rewarding game series ever. 

The devs have acknowledged the problem and I’m sure it will be addressed soon.",1517029930.0
/r/xboxone/comments/ef3umg/xbox_series_x_rathalos_edition_not_the_best/,https://i.redd.it/9psj48ou2m641.png,"Xbox Series X : Rathalos Edition, not the best design but had fun making it !",97,3443,SerifGrey,,1577206439.0
/r/xboxone/comments/j28l9o/tom_warren_i_gotta_say_im_really_surprised/,https://twitter.com/tomwarren/status/1311053498201575424,"Tom Warren: I gotta say, I’m really surprised Microsoft has sent out Xbox Series X units nearly 2 months before retail release. I don’t think I’ve ever previewed a product at home this early before. Getting more than 2 weeks before a hardware launch is extremely rare",446,3128,NeoStark,,1601414745.0
/r/xboxone/comments/gs5tu2/xbox_series_x_the_most_powerful_and_compatible/,https://news.xbox.com/en-us/2020/05/28/xbox-series-x-next-generation-backward-compatibility/,Xbox Series X: The Most Powerful and Compatible Next-Gen Console with Thousands of Games at Launch,628,3079,Turbostrider27,,1590670806.0
/r/xboxone/comments/i4vleg/doom_eternal_and_the_elder_scrolls_online/,https://www.ign.com/articles/doom-eternal-and-the-elder-scrolls-online-announced-for-ps5-and-xbox-series-x-with-free-upgrades,Doom Eternal and The Elder Scrolls Online Announced for PS5 and Xbox Series X With Free Upgrades,193,3035,welshdragon888,,1596733382.0
/r/xboxone/comments/j5rfdk/my_brotherinlaw_spent_80_hours_designing_and_3d/,https://www.reddit.com/gallery/j5rfdk,My brother-in-law spent 80 hours designing and 3D printing this Xbox Series X piggy bank for my birthday so I can store all the money I'm saving for the new console,103,2867,NotIansIdea,,1601930445.0
/r/xboxone/comments/f8tdpj/xbox_series_x_dropping_bombs_on_this_monday/,https://i.redd.it/u000nv3zawi41.jpg,Xbox Series X dropping bombs on this Monday!,342,2863,MoronicaForever,,1582560369.0
/r/xboxone/comments/ilm8t6/taco_bell_teaming_up_with_microsoftxbox_series_x/,https://imgur.com/a/XrrLYMn,Taco Bell teaming up with Microsoft/Xbox Series X this year!,360,2710,Sim3111,,1599105218.0
/r/xboxone/comments/27pmsb/halo_the_master_chief_edition_halo_14_confirmed/,https://www.reddit.com/r/xboxone/comments/27pmsb/halo_the_master_chief_edition_halo_14_confirmed/,Halo: The Master Chief Edition (Halo 1-4) Confirmed - Releases November 11,1355,2483,CaCHooKaMan,"*collection

YES

Trailer: https://www.youtube.com/watch?v=aPGPiSpTw4w

More info: http://www.ign.com/articles/2014/06/09/e3-2014-halo-the-master-chief-collection-halo-5-beta-announced-for-xbox-one

* $59.99
* 1080p, 60 FPS
* Dedicated Servers
* Full Halo 2 Multiplayer intact
* Separate Multiplayer for all 4 games
* Over 100 maps running on original engines
* All levels and game modes unlocked from the start
* Custom playlists that allow you to combine experiences from all 4 games
* 4000 Gamerscore
* Access to Halo 5 Multiplayer Beta Included (December 27 - January 22)
* Digital Series 'Halo: Nightfall' also included",1402334670.0
