submission,author,body,score,created,url_of_post
fa0777,ChunkyThePotato,"I think a power outage would still make you have to restart the game. The Xbox would need 10 seconds or whatever to transfer the game state from RAM to the SSD, and something like a power outage is unexpected and sudden, so it wouldn't get the chance to do that. It's only if you actually tell the console to restart that it can anticipate the power cut and take the time it needs to write the game state to the SSD.",64,1582755505.0,/r/xboxone/comments/fa0777/microsofts_xbox_series_x_will_be_able_to_resume/
fa0777,LegendAssassin85,It obviously won’t work for games that are online only games.,276,1582755011.0,/r/xboxone/comments/fa0777/microsofts_xbox_series_x_will_be_able_to_resume/
fa0777,SonsOfZadok,"That's becouse on the Xbox one systems resume is done by keeping the game in ram. When you go to do other things, sometimes the game state that is loaded into ram gets interrupted becouse other apps require ram too. With the Series X, the games will ""dump"" the game state out of ram onto the SSD very quickly which is a permanent memory unlike ram. And there is a lot more storage on the SSD than there will be ram, so we can quickly resume multiple games.",62,1582757610.0,/r/xboxone/comments/fa0777/microsofts_xbox_series_x_will_be_able_to_resume/
fa0777,ChunkyThePotato,"RAM uses volatile memory. That means it cannot sustain data when power is cut. So when the console reboots, the data in RAM must be transferred to the SSD in order for it to not be lost.",56,1582757352.0,/r/xboxone/comments/fa0777/microsofts_xbox_series_x_will_be_able_to_resume/
fa0777,Solid_Snark,"I assume the online would work the same as it does now.  Kind of like Destiny 2.  If your session is interrupted, it will hold your place on the server for only a few minutes.

If you can rejoin in that time, you continue playing where your team currently is. 

If you can’t rejoin, your place is given to the next player queuing in matchmaking.

And if your team completed the mission, the game has ended and you can’t rejoin (for obvious reasons).",102,1582758365.0,/r/xboxone/comments/fa0777/microsofts_xbox_series_x_will_be_able_to_resume/
iwour0,Finally_Smiled,"It should just be /r/Xbox honestly. The new Xbox family is just called ""Xbox"" with Series X/S as a designator. It's should be perfect.

But I don't think that subreddit is properly moderated.",1871,1600644705.0,/r/xboxone/comments/iwour0/unpopular_opinion_we_need_to_unify_all_xbox/
iwour0,krul2k,With this sub having over 2mill ppl i honestly thought it was a given this place was just going to drop the One and become the xbox sub.,115,1600657384.0,/r/xboxone/comments/iwour0/unpopular_opinion_we_need_to_unify_all_xbox/
iwour0,TigerSkull79,"I agree. As a someone coming from PlayStation I didn't have a clue which sub to join, I settled on just this one in the end 🤷🏻‍♂️",193,1600644626.0,/r/xboxone/comments/iwour0/unpopular_opinion_we_need_to_unify_all_xbox/
iwour0,GreenBlueSeduce,"Should just be r/Xbox. Since it’s a blanket sub, we’ll never have to have this discussion again because it will fit the next generation as well, unlike the gen specific ones Xboxone and xboxseriesx. 

If we get the mods to agree on one, over time every one will migrate to it, no point in picking based on the one that has the most now because that can change eventually. 

Just put a pinned post on all the other subreddits saying r/Xbox is the main sub. 

It’s the easiest to find for new people. 

We can use flairs to denote what console were referring to in our posts. 

Subscribing to them all just means duplicate posts and fragmented discussion.",72,1600666582.0,/r/xboxone/comments/iwour0/unpopular_opinion_we_need_to_unify_all_xbox/
iwour0,Nechaev,"While I agree with your wishes, the mods of the respective subs are going to be biggest obstacle to something like that happening. 

There are good mods who want to nuture a thriving community with interesting discussions and content... and then there are bad mods who just want to accumulate power and influence (for a complicated number of reasons it's not necessary to dwell on here).

Subreddit moderation works in a very hierarchical manner. Are the mods of one subreddit going to readily relinquish their position to give it some other random name across the internet? I'd be reluctant and I understand theirs. 

What if we end up with the top mod of some Xbox ""Ultimate"" subreddit being a power-hungry jerk? We're stuck with them. As long as they're active on reddit they can't be removed even if every single subscriber wants them gone. 

There's no democracy when it comes to that part of reddit. Your ""say"" on the matter ends with being able to upvote and downvote posts and that's it sadly.",75,1600653220.0,/r/xboxone/comments/iwour0/unpopular_opinion_we_need_to_unify_all_xbox/
iwour0,Vokun_,Agreed. Merge them all into r/xbox,114,1600657565.0,/r/xboxone/comments/iwour0/unpopular_opinion_we_need_to_unify_all_xbox/
iwour0,meezethadabber,"r/XboxSeriesX has the most subs out of those at 130+k and the most traffic besides this one. So I'd say that one. No point making a new sub because the Series S got announced and someone wants to put ""S"" in the Subs name.",57,1600645587.0,/r/xboxone/comments/iwour0/unpopular_opinion_we_need_to_unify_all_xbox/
iwour0,WyldeGi,"Exactly. I wish we had better moderators over there, and it would start feeling a bit more organized and inclusive",335,1600644881.0,/r/xboxone/comments/iwour0/unpopular_opinion_we_need_to_unify_all_xbox/
iwour0,Enriador,Subreddits cannot change names.,63,1600670748.0,/r/xboxone/comments/iwour0/unpopular_opinion_we_need_to_unify_all_xbox/
iwour0,WyldeGi,"Yeah same here. I just subbed to all of them because I didn’t know if there would be a swap or not. It seems like most are setting on this sub as well, but it does trigger my OCD a bit that next gen console info will be on a community focused around the r/XboxOne, but Thats not the biggest deal",50,1600644815.0,/r/xboxone/comments/iwour0/unpopular_opinion_we_need_to_unify_all_xbox/
iwour0,VagueSomething,"Trouble with that sub is it is a mess. Heavily brigaded and at least one mod is under suspicion of not wanting to stop it. Far too often you see pro PS5 comments being upvoted and anything that uses facts against it getting downvoted.


Hell I had someone in that sub tell me that no AAA will ever be on Game Pass including Halo Infinite. The person didn't get downvoted or opposed.",53,1600648193.0,/r/xboxone/comments/iwour0/unpopular_opinion_we_need_to_unify_all_xbox/
iwour0,joecamnet,This might be one of the only times I've seen praise of the mods here.,152,1600644954.0,/r/xboxone/comments/iwour0/unpopular_opinion_we_need_to_unify_all_xbox/
iwour0,WyldeGi,"Well, in comparison to r/Xbox, they’re a lot better lmao lemme fix my comment",139,1600644985.0,/r/xboxone/comments/iwour0/unpopular_opinion_we_need_to_unify_all_xbox/
iwour0,salondesert,"It *feels* like maybe r/XboxSeriesX has the best moderators/run subreddit

I mean, r/xboxone doesn't feel bad by any means, though

Anyway, yeah, the fracutring of all the Xbox stuff on reddit (incl. r/xcloud) is really unfortunate",97,1600653223.0,/r/xboxone/comments/iwour0/unpopular_opinion_we_need_to_unify_all_xbox/
iwour0,Rickmasta,This sub is almost 18x larger than /r/XboxSeriesX. It's going to be significantly harder to moderate.,76,1600670790.0,/r/xboxone/comments/iwour0/unpopular_opinion_we_need_to_unify_all_xbox/
fbttjh,-Friddles-,"To be clear:

There's  ""xbox **one** x"", which is a more powerful version of his current console that will run all the same games.

Confusingly, there's going to be  (at Christmas time) a brand new console called the ""xbox **series** x"" which will play the very latest games going forward. 

You may want to hold off buying until then (unless his current console is broken)

It goes without saying, you are a wonderful mother :)",1750,1583068858.0,/r/xboxone/comments/fbttjh/help_a_mum_out_please/
fbttjh,AnalogMan,"Something I'm not seeing stressed enough. The Xbox One X comes with a an HDMI cable. Specifically, it comes with a 4K capable HDMI cable. Use it. Swap out the HDMI cable you have now for the one that comes with the X, don't just re-use the old HDMI cable even if it does work because it's likely not as high quality.",593,1583073603.0,/r/xboxone/comments/fbttjh/help_a_mum_out_please/
fbttjh,Jah36Ubandafitzjerld,"Yes the hdmi will have to be a high speed for the 4K and 60fps for the Xbox one x. But when you buy it, it should come with everything. So you’re good mom! Thanks for being a good one for your kids! Ik they appreciate it

Edited",1536,1583068258.0,/r/xboxone/comments/fbttjh/help_a_mum_out_please/
fbttjh,thinkb4youspeak,"Always remember with 4K you can have all the cables you like, if your TV or Monitor doesn't display 4K then you will have HD resolution and honestly that's good enough for gaming if you cant afford 4K like a lot of people.",55,1583073106.0,/r/xboxone/comments/fbttjh/help_a_mum_out_please/
fbttjh,Zede24,"Hi, it seems that your question was answered by other users already but might I add that a new generation of consoles is dropping this winter so you can talk to him and buy him the new one instead of the One X.

The One X will start to lose support gradually after the new release so it's not really a wise investment. 

Happy Birthday to your son :)",112,1583068865.0,/r/xboxone/comments/fbttjh/help_a_mum_out_please/
fbttjh,nicskoll,Something to think about; thank you very much for your help. He's a good lad and deserves a treat.,1117,1583069463.0,/r/xboxone/comments/fbttjh/help_a_mum_out_please/
fbttjh,Drrky,"Great tip, didn’t know that! Just went through my closet and found it! ☺️",107,1583078740.0,/r/xboxone/comments/fbttjh/help_a_mum_out_please/
fbttjh,nicskoll,Thank you so much :-) He's a  good lad and deserves a treat,720,1583069387.0,/r/xboxone/comments/fbttjh/help_a_mum_out_please/
fbttjh,nicskoll,"Thank you very much for your advice, and good wishes :-)",50,1583069498.0,/r/xboxone/comments/fbttjh/help_a_mum_out_please/
fbttjh,Xbox_Live_User,"Side note:
Date isn't confirmed yet but most likely the 'Series X' will be released in November [22nd] because that's when Microsoft likes to release.

I'd assume the new one will be like $400-$500 USD and the [current] Xbox One X is about $300 USD.",422,1583071843.0,/r/xboxone/comments/fbttjh/help_a_mum_out_please/
fbttjh,DTM_Chef,"I also would recommend asking him if he’d rather have the new Xbox that is slated to come out at the end of the year instead. Instead of spending your hard earned money to make him happy for 6 months I’d suggest seeing if he’d rather wait for the latest Xbox so he will be happy for 7 years. Because as soon as that new one comes out and his friends get it for Xmas he will look at his new toy like it stabbed him in the back. 

The new consoles are slated for October - December 2020 in case you were wondering.",1058,1583075648.0,/r/xboxone/comments/fbttjh/help_a_mum_out_please/
fbttjh,Scrch1807,"My mom would never do this, can you adopt me",79,1583074909.0,/r/xboxone/comments/fbttjh/help_a_mum_out_please/
fbttjh,mantis2112,This mom is baddass,86,1583073621.0,/r/xboxone/comments/fbttjh/help_a_mum_out_please/
fbttjh,ReeceReddit1234,Wasn't a One X like $499 when it released? Unless I'm making stuff up. I can see Series X being at least that probably more,155,1583073432.0,/r/xboxone/comments/fbttjh/help_a_mum_out_please/
fbttjh,dustygultch,"While true, he would still be able to play with his upgraded friends, at least in the Series X beginning life span. They have mentioned cross generational gaming. Doesn't mean he doesn't want the new one anyway though! Just a thought.",79,1583078427.0,/r/xboxone/comments/fbttjh/help_a_mum_out_please/
fbttjh,theHuntForCunt,"Yes this needs to be upvoted so mom can see this.. Its the best advice

Edit: I meant the comment that I replied too but hey thanks for the upvotes haha",153,1583077038.0,/r/xboxone/comments/fbttjh/help_a_mum_out_please/
fbttjh,nicskoll,"If you promise to help out with dog walking duties, then yes! Welcome, little one.",157,1583075224.0,/r/xboxone/comments/fbttjh/help_a_mum_out_please/
fbttjh,Xbox_Live_User,"Yeah but in a interview with Phil Spencer he said ""learning from the Xbox One generation is we will not be out of position on power or price"".  So it sounds like they want to be really competitive with price.  $499 is probably the realistic guesstimate.",131,1583074299.0,/r/xboxone/comments/fbttjh/help_a_mum_out_please/
fbttjh,newgibben,He's 37.,87,1583076147.0,/r/xboxone/comments/fbttjh/help_a_mum_out_please/
fbttjh,Ereaser,If you're 37 you can still have a mom and be called little one by her,66,1583076214.0,/r/xboxone/comments/fbttjh/help_a_mum_out_please/
fbttjh,indigo121,Pretty high. They're both aiming for more or less the same price point with more or less the same available technology and more or less the same developer needs. They're doing enough research and negotiations with manufacturers that they're both going to get the best rates available. It would be more surprising if they were wildly different.,57,1583075170.0,/r/xboxone/comments/fbttjh/help_a_mum_out_please/
hb3kok,Aielman15,"""Yeah there is a console for you if you want a sticker and it's called Xbox One X"" - Don Mattrick (probably)",1477,1592446948.0,/r/xboxone/comments/hb3kok/phill_spencer_drops_a_bomb_on_twitter_confirms/
hb3kok,DesertofBoredom,He said it won't have one like in that image. It will actually have a much larger HDMI sticker than that.,1296,1592443490.0,/r/xboxone/comments/hb3kok/phill_spencer_drops_a_bomb_on_twitter_confirms/
hb3kok,ppenn777,Since they’re removing the sticker can’t they replace it with a chat headset again? Miss the days when they included a headset.,103,1592449120.0,/r/xboxone/comments/hb3kok/phill_spencer_drops_a_bomb_on_twitter_confirms/
hb3kok,Vykander,Well I'll just have to transfer the sticker from my 1 X. Goddammit Phil.,452,1592443783.0,/r/xboxone/comments/hb3kok/phill_spencer_drops_a_bomb_on_twitter_confirms/
hb3kok,Mansome_reddit,"I am lost here, why does this matter?",479,1592440630.0,/r/xboxone/comments/hb3kok/phill_spencer_drops_a_bomb_on_twitter_confirms/
hb3kok,UserAccount120,Finally a win for 2020,262,1592439396.0,/r/xboxone/comments/hb3kok/phill_spencer_drops_a_bomb_on_twitter_confirms/
hb3kok,jaylimo,"I left the sticker on my original XBox One and when I shipped it in for repairs, they returned it without it😭",117,1592447261.0,/r/xboxone/comments/hb3kok/phill_spencer_drops_a_bomb_on_twitter_confirms/
hb3kok,TTBurger88,"That does it... Pre ordered cancelled.. Joining the PS5 crew this generation..

/s",75,1592446842.0,/r/xboxone/comments/hb3kok/phill_spencer_drops_a_bomb_on_twitter_confirms/
hb3kok,FudgeSlapp,TeamSticker is literally trembling in their shoes rn,55,1592443991.0,/r/xboxone/comments/hb3kok/phill_spencer_drops_a_bomb_on_twitter_confirms/
hb3kok,evenios,preorder cancelled,58,1592445021.0,/r/xboxone/comments/hb3kok/phill_spencer_drops_a_bomb_on_twitter_confirms/
hb3kok,Swarl3sBarkl3y,Can't wait for playstations response to this.,61,1592441340.0,/r/xboxone/comments/hb3kok/phill_spencer_drops_a_bomb_on_twitter_confirms/
hb3kok,Phadrix,"This comment actually made me laugh. Had to watch the video again. That guy was such a buffoon. 

[Source](https://youtu.be/J_JVVUnCWnY) for those that don’t know.",503,1592452503.0,/r/xboxone/comments/hb3kok/phill_spencer_drops_a_bomb_on_twitter_confirms/
hb3kok,Re-toast,Love that we can joke about this now. Man at the time it was almost a death blow to the console.,84,1592454032.0,/r/xboxone/comments/hb3kok/phill_spencer_drops_a_bomb_on_twitter_confirms/
hb3kok,crowcawer,If you put three XSX in a row you can see the sticker.,304,1592445843.0,/r/xboxone/comments/hb3kok/phill_spencer_drops_a_bomb_on_twitter_confirms/
hb3kok,xLEDxZEPPELINx,I have no clue whats being talked about here,57,1592451766.0,/r/xboxone/comments/hb3kok/phill_spencer_drops_a_bomb_on_twitter_confirms/
hb3kok,R1ckyRampag3,"Getting a furious “my mics broke bro” text message, while playing Halo, from a friend knowing damn good and well he had one of those janky white pieces of crap!",61,1592451749.0,/r/xboxone/comments/hb3kok/phill_spencer_drops_a_bomb_on_twitter_confirms/
hb3kok,smurf_diggler,Seriously. Is there like a back up process? What if I need tech support.,87,1592450134.0,/r/xboxone/comments/hb3kok/phill_spencer_drops_a_bomb_on_twitter_confirms/
hb3kok,Im-M-A-Reyes,"This is more of a joke. Xbox Ones had the hdmi sticker near disc drive.

Some folks immediately tore it off while others are more civilized and proudly display it front and off-center on their console!",862,1592441494.0,/r/xboxone/comments/hb3kok/phill_spencer_drops_a_bomb_on_twitter_confirms/
hb3kok,Thestarmoops,We needed this one.,61,1592444383.0,/r/xboxone/comments/hb3kok/phill_spencer_drops_a_bomb_on_twitter_confirms/
hb3kok,InherentPersona,Sounds like they fixed more than one problem,158,1592450045.0,/r/xboxone/comments/hb3kok/phill_spencer_drops_a_bomb_on_twitter_confirms/
hb3kok,,The PS5 sticker has aluminum behind it so it acts as a heat sink thus improving thermal cooling efficiency and we pay for exclusives and screw you Xbox fans.,98,1592442734.0,/r/xboxone/comments/hb3kok/phill_spencer_drops_a_bomb_on_twitter_confirms/
hb3kok,prboi,Those were dark times indeed,251,1592453760.0,/r/xboxone/comments/hb3kok/phill_spencer_drops_a_bomb_on_twitter_confirms/
hb3kok,Arcon1337,That line still has done permanent damage to this very day.,81,1592454850.0,/r/xboxone/comments/hb3kok/phill_spencer_drops_a_bomb_on_twitter_confirms/
hb3kok,MapleTreeWithAGun,The console arrives and it's just a sticker,175,1592447516.0,/r/xboxone/comments/hb3kok/phill_spencer_drops_a_bomb_on_twitter_confirms/
hb3kok,silkysmoothjay,"I just now found out it was a sticker, after five years of owning my console",306,1592446443.0,/r/xboxone/comments/hb3kok/phill_spencer_drops_a_bomb_on_twitter_confirms/
hb3kok,,"There is a name for those who keep their stickers on.

Heathens.",213,1592442829.0,/r/xboxone/comments/hb3kok/phill_spencer_drops_a_bomb_on_twitter_confirms/
hb3kok,colourmeinkindness_,Literally set the brand back years,270,1592455037.0,/r/xboxone/comments/hb3kok/phill_spencer_drops_a_bomb_on_twitter_confirms/
hb3kok,jnrdingo,Thats a damn impressive sticker if it can output 4k60,79,1592448784.0,/r/xboxone/comments/hb3kok/phill_spencer_drops_a_bomb_on_twitter_confirms/
hb3kok,,"Yeah,  I've owned the Original Xbox. Vanilla 360, 360 Slim, 2 360 Elites and now my 1X....... Never new this was a thing until tonight",51,1592449992.0,/r/xboxone/comments/hb3kok/phill_spencer_drops_a_bomb_on_twitter_confirms/
hb3kok,Sleaka_J,AND THEN?,103,1592446920.0,/r/xboxone/comments/hb3kok/phill_spencer_drops_a_bomb_on_twitter_confirms/
hb3kok,KungFooRobot,"It’s like when people use to put plastic over their couch to keep it clean. I guess it’ll be clean, but it looks more trashy that way.",83,1592447232.0,/r/xboxone/comments/hb3kok/phill_spencer_drops_a_bomb_on_twitter_confirms/
hb3kok,Phadrix,Probably set them back almost a decade tbh. This whole generation was doomed for them after that E3.,204,1592458553.0,/r/xboxone/comments/hb3kok/phill_spencer_drops_a_bomb_on_twitter_confirms/
hb3kok,herbmaster47,I Am Not A Stickerologist,61,1592453925.0,/r/xboxone/comments/hb3kok/phill_spencer_drops_a_bomb_on_twitter_confirms/
hb3kok,silkysmoothjay,Do not care enough to do anything,241,1592446947.0,/r/xboxone/comments/hb3kok/phill_spencer_drops_a_bomb_on_twitter_confirms/
hb3kok,identitycrisis1,"If we’re being realistic here, though, the problem was that Xbox was too far ahead of the curve at that point. They were aggressively pushing towards all digital way before the general public was comfortable with the idea of only having digital games. The original plan for game sharing they described would have been great for an all digital gaming environment. But forcing it on everyone was never going to work, people like to have options even if the majority end up doing what was being forced on them in the first place.",203,1592460588.0,/r/xboxone/comments/hb3kok/phill_spencer_drops_a_bomb_on_twitter_confirms/
hb3kok,,YOU MONSTER,57,1592448634.0,/r/xboxone/comments/hb3kok/phill_spencer_drops_a_bomb_on_twitter_confirms/
hb3kok,DannyDropshadow,I like you.,71,1592447912.0,/r/xboxone/comments/hb3kok/phill_spencer_drops_a_bomb_on_twitter_confirms/
hb3kok,sithlordmaster181,Agreed. Personally I love having all my games installed digitally with no disc.,84,1592462685.0,/r/xboxone/comments/hb3kok/phill_spencer_drops_a_bomb_on_twitter_confirms/
hb3kok,,[deleted],71,1592461355.0,/r/xboxone/comments/hb3kok/phill_spencer_drops_a_bomb_on_twitter_confirms/
hb3kok,Eddielowfilthslayer,"Digital is great for short term, but I feel like it will be a pain in the ass trying to replay those games in 15 years. Meanwhile my physical copy of Vice City still works on any PS2 after 18 years.",94,1592466144.0,/r/xboxone/comments/hb3kok/phill_spencer_drops_a_bomb_on_twitter_confirms/
hb3kok,SevenM,"It doesn't even take that long. The moment there is a licencing issue, the game is no longer available. I bought Scott Pilgrim but after my original console broke down i can no longer download it. Happened in the Google play store as well. Bought the Shadowrun games, but can't download them after getting a new phone. They can even limit a game after it's been released. Games like  GTA IV have lost a good chunk of their songs do to licenses expiring.",64,1592468516.0,/r/xboxone/comments/hb3kok/phill_spencer_drops_a_bomb_on_twitter_confirms/
fk8tau,Coolman_Rosso,"Really pumped for the BC stuff.

Curious how more stylized/cartoony titles like Prince of Persia 08, Viva Pinata, and Blue Dragon will look.

Hell I might even dig up my Blinx disc that i never touched.",478,1584477612.0,/r/xboxone/comments/fk8tau/bring_your_favorite_games_with_you_to_xbox_series/
fk8tau,MrGreenBeanz,Will my existing usb 3.0 hard drive work or does it have to be 3.1?,166,1584466621.0,/r/xboxone/comments/fk8tau/bring_your_favorite_games_with_you_to_xbox_series/
fk8tau,irridisregardless,Xbox Series X games are designed around the fast SSD storage and won't run from USB HDDs (curious me wonders about USB 3.2 NVME drives tho),385,1584465582.0,/r/xboxone/comments/fk8tau/bring_your_favorite_games_with_you_to_xbox_series/
fk8tau,brianstormIRL,"So essentially, any external USB drives for Series X games will only act as a garage, so to speak. Dont want to delete the game you downloaded that's 150gb? Swap it to external storage drive instead. Want to play it again? Swap it back to internal storage. 

This is a pretty good solution IMHO. Internal for games you actually play regularly, external for ones you dont.",131,1584473943.0,/r/xboxone/comments/fk8tau/bring_your_favorite_games_with_you_to_xbox_series/
fk8tau,Orangebalr0g,"A whole lotta dense comments here. My favorite so far is ""will my discs play?"".",64,1584474108.0,/r/xboxone/comments/fk8tau/bring_your_favorite_games_with_you_to_xbox_series/
fk8tau,Mustache_Guy,Oof those comments. How is this so hard to understand?,145,1584471731.0,/r/xboxone/comments/fk8tau/bring_your_favorite_games_with_you_to_xbox_series/
fk8tau,b_beck614,Is prince of Persia XB1 compatible?,60,1584484231.0,/r/xboxone/comments/fk8tau/bring_your_favorite_games_with_you_to_xbox_series/
fk8tau,rokfest,3.0 will work just fine,72,1584469213.0,/r/xboxone/comments/fk8tau/bring_your_favorite_games_with_you_to_xbox_series/
fk8tau,IWaveAtTeslas,"Just an FYI, the naming conventions have changed for USB 3.0 and USB 3.1. They are now called USB 3.2 Gen 1 and USB 3.2 Gen 2, respectively. And the newest spec is called USB 3.2 Gen 2x2.",90,1584476440.0,/r/xboxone/comments/fk8tau/bring_your_favorite_games_with_you_to_xbox_series/
fk8tau,accountsdontmatter,Yes but that's not what this is about. This about I can move my USB drive from my S onto the series X and play them without any bother.,123,1584475668.0,/r/xboxone/comments/fk8tau/bring_your_favorite_games_with_you_to_xbox_series/
fk8tau,JP76,Microsoft probably can't ensure performance of an external USB drive. You might get thermal throttling or USB controller itself couldn't cope especially if people use USB hubs and have webcams and regular external HDDs on top of USB nvme.,125,1584466336.0,/r/xboxone/comments/fk8tau/bring_your_favorite_games_with_you_to_xbox_series/
fk8tau,tukatu0,Having no relevant knowledge. When have you ever needed to know what is nvme using an xbox 1s,74,1584474082.0,/r/xboxone/comments/fk8tau/bring_your_favorite_games_with_you_to_xbox_series/
fk8tau,pinkyetti,Yes and the forgotten sands. Both are on sale currently,57,1584484757.0,/r/xboxone/comments/fk8tau/bring_your_favorite_games_with_you_to_xbox_series/
fk8tau,Zacitus,Not confusing at all.,170,1584477261.0,/r/xboxone/comments/fk8tau/bring_your_favorite_games_with_you_to_xbox_series/
fk8tau,notyouravgredditor,"Exactly, this is about transferring and not downloading hundreds of GB again.",64,1584483880.0,/r/xboxone/comments/fk8tau/bring_your_favorite_games_with_you_to_xbox_series/
fk8tau,Mustache_Guy,"That's not my point.

My point is that phil spencer, media, and major Nelson have all explained how it works yet people still don't get it.

They keep asking questions that are answered in the posts they're replying to.

That tweet literally says you can just plug in your external and your past games will be good to go and just play. Which is then followed up by people asking if they can still download their games from Xbox Live or if they're losing them if they don't have a hard drive. Plus more frankly astounding questions that have already been answered multiple times.",71,1584474262.0,/r/xboxone/comments/fk8tau/bring_your_favorite_games_with_you_to_xbox_series/
