submission,author,body,score,created,url_of_post
e9xirg,therealtinnyhippo,"Some extra info, courtesy of this official Microsoft announcement:

Yes, the box can sit both vertically and horizontally

The controller is technically new. Microsoft say “Its size and shape have been refined to accommodate an even wider range of people, and it also features a new Share button to make capturing screenshots and game clips simple and an advanced d-pad derived from the Xbox Elite Series 2 Wireless Controller. The new Xbox Wireless Controller will be compatible with Xbox One and Windows 10 PCs, and will be included with every Xbox Series X.

It’ll support 60fps at 4K, “with possibility of up to 120FPS”, and will also support 8K visuals.

The Xbox Series X has a “next-generation SSD will virtually eliminate load times.”

It’s backwards compatible! Across all previous Xboxes! “Thanks to backward compatibility, you can expect your gaming legacy, thousands of your favorite games across four generations of gaming, all your Xbox One gaming accessories, and industry-leading services like Xbox Game Pass to be available when you power on your Xbox Series X in Holiday 2020.”",2348,1576209262.0,/r/xboxone/comments/e9xirg/xbox_series_x_world_premier_4k_trailer/
e9xirg,IndieAdmirer,[The state of this sub come Holiday 2020. ](https://media2.giphy.com/media/cT3wMhLGQWdKU/giphy.gif?cid=4d1e4f29ebd29986eb1aa8218a7cfa74d3c035768fcaf4ec&rid=giphy.gif),3439,1576205127.0,/r/xboxone/comments/e9xirg/xbox_series_x_world_premier_4k_trailer/
e9xirg,,"At the very least it looks like it's going to have great ventilation.

Truth be told i was already sold when they said all prior Xbox one accessories and the entire catalog of games already available on X1 would carry over, but still.",3805,1576203791.0,/r/xboxone/comments/e9xirg/xbox_series_x_world_premier_4k_trailer/
e9xirg,shugo2000,Did *not* see that coming tonight!!,3046,1576203213.0,/r/xboxone/comments/e9xirg/xbox_series_x_world_premier_4k_trailer/
e9xirg,DrNick1221,Holy crap thats a lot more.... vertical than I expected.,3964,1576203228.0,/r/xboxone/comments/e9xirg/xbox_series_x_world_premier_4k_trailer/
e9xirg,Smathers,So is this the Scarlett ?,1694,1576204010.0,/r/xboxone/comments/e9xirg/xbox_series_x_world_premier_4k_trailer/
e9xirg,TFM_Jeff,"[""We also designed Xbox Series X to support both vertical and horizontal orientation.""](https://news.xbox.com/en-us/2019/12/12/microsoft-unveils-xbox-series-x/)",441,1576205446.0,/r/xboxone/comments/e9xirg/xbox_series_x_world_premier_4k_trailer/
e9xirg,majornelson,Hope you enjoyed the reveal  :),1632,1576215776.0,/r/xboxone/comments/e9xirg/xbox_series_x_world_premier_4k_trailer/
e9xirg,UnoriginalGinger,Controller has a third button between the start and select buttons. Not sure what it does but hope it’s a dedicated capture button. Otherwise looks very similar to the XBO controller. https://i.imgur.com/oxHXpPe.jpg,986,1576204225.0,/r/xboxone/comments/e9xirg/xbox_series_x_world_premier_4k_trailer/
e9xirg,ex-aid911,Wow Geoff was not kidding. What a surprise.,1183,1576203217.0,/r/xboxone/comments/e9xirg/xbox_series_x_world_premier_4k_trailer/
e9xirg,ezidro3,Completely out of left field. Holy shit.,761,1576203249.0,/r/xboxone/comments/e9xirg/xbox_series_x_world_premier_4k_trailer/
e9xirg,Imjustahero,I was here when the Xbox became an actual box,4253,1576203197.0,/r/xboxone/comments/e9xirg/xbox_series_x_world_premier_4k_trailer/
e9xirg,SkyEpsilon,"Xbox Series X

Xbox SeX",2682,1576203699.0,/r/xboxone/comments/e9xirg/xbox_series_x_world_premier_4k_trailer/
e9xirg,noodlz05,Out of fucking nowhere,551,1576203253.0,/r/xboxone/comments/e9xirg/xbox_series_x_world_premier_4k_trailer/
e9xirg,Ashtronica2,"The person talking is Alan Watts if anyone is interested. He has some great lectures.

Edit: I agree he probably wouldn’t have been too into using this for an advertisement. Also, along with Alan Watts I encourage people to check out Joseph Campbell. Both people have been amazing to listen to in my life in different ways.",406,1576205391.0,/r/xboxone/comments/e9xirg/xbox_series_x_world_premier_4k_trailer/
e9xirg,A_Kind_Shark,"Disregarding the design and the name, can we talk about how beautiful that trailer was?",223,1576206078.0,/r/xboxone/comments/e9xirg/xbox_series_x_world_premier_4k_trailer/
e9xirg,Zeyz,"Maybe just me, but I fucking love the design. Will look great in my living room.",1458,1576203208.0,/r/xboxone/comments/e9xirg/xbox_series_x_world_premier_4k_trailer/
e9xirg,Blck_Captain_America,Hopefully there’s some good trade in offers for the XB1X towards the Series X,458,1576203992.0,/r/xboxone/comments/e9xirg/xbox_series_x_world_premier_4k_trailer/
e9xirg,ChunkyThePotato,Well that came out of fucking nowhere.,355,1576203246.0,/r/xboxone/comments/e9xirg/xbox_series_x_world_premier_4k_trailer/
e9xirg,empw,"OH SHIIIIIIIIIIT

I like the design but am not a fan of the name.",535,1576203222.0,/r/xboxone/comments/e9xirg/xbox_series_x_world_premier_4k_trailer/
e9xirg,stan3298,"Some people will make fun of it, but personally I love minimalist design and think this looks really nice.",227,1576204601.0,/r/xboxone/comments/e9xirg/xbox_series_x_world_premier_4k_trailer/
e9xirg,joshyjoshj,Pc is so good xbox is making pc 2,976,1576203237.0,/r/xboxone/comments/e9xirg/xbox_series_x_world_premier_4k_trailer/
e9xirg,BCRplus44,I saw someone call this the Xbox Fridge and I love it lmao. Gotta trade in my X for this when it comes out,102,1576203695.0,/r/xboxone/comments/e9xirg/xbox_series_x_world_premier_4k_trailer/
e9xirg,mathfacts,"I think 

Xbox Series S

Will be the name for ""Lockhart""",139,1576204181.0,/r/xboxone/comments/e9xirg/xbox_series_x_world_premier_4k_trailer/
e9xirg,mrps4man,Xbox rectangle,217,1576203245.0,/r/xboxone/comments/e9xirg/xbox_series_x_world_premier_4k_trailer/
e9xirg,TTBurger88,"So the next Xbox is called Xbox Series X?

Not sure on the name the look of it looks alright.",146,1576203456.0,/r/xboxone/comments/e9xirg/xbox_series_x_world_premier_4k_trailer/
e9xirg,INeverPlayedF-Zero,Issa box.,146,1576203230.0,/r/xboxone/comments/e9xirg/xbox_series_x_world_premier_4k_trailer/
e9xirg,Pyrocezar,"**You Son of a Bitch, I'm In**",180,1576204921.0,/r/xboxone/comments/e9xirg/xbox_series_x_world_premier_4k_trailer/
e9xirg,hardangelfan,Can Xbox have normal names?,259,1576203474.0,/r/xboxone/comments/e9xirg/xbox_series_x_world_premier_4k_trailer/
e9xirg,MPGamer18,I was hearing it looked like shit. I fucking like it. Now it can go on the floor without issue.,62,1576204301.0,/r/xboxone/comments/e9xirg/xbox_series_x_world_premier_4k_trailer/
e9xirg,Hummer77x,how are they so bad at naming these things,677,1576203254.0,/r/xboxone/comments/e9xirg/xbox_series_x_world_premier_4k_trailer/
e9xirg,psfanboy,"MS clearly doesn't know how to make their systems meme proof

They went from XBone to XSex",75,1576204305.0,/r/xboxone/comments/e9xirg/xbox_series_x_world_premier_4k_trailer/
e9xirg,SamiMadeMeDoIt,"It's basically a PC tower lol

Don't know how I feel about that design",410,1576203210.0,/r/xboxone/comments/e9xirg/xbox_series_x_world_premier_4k_trailer/
e9xirg,Lord_Boborch,this is the scarlett? it looks so wack i love it,136,1576203204.0,/r/xboxone/comments/e9xirg/xbox_series_x_world_premier_4k_trailer/
e9xirg,Laughing__Man_,Phil stated multiple studios already have this. So is this disproving the earlier rumor that they did not have kits out to devs?,81,1576203344.0,/r/xboxone/comments/e9xirg/xbox_series_x_world_premier_4k_trailer/
e9xirg,FancyKilerWales,It's basically a computer tower,62,1576203262.0,/r/xboxone/comments/e9xirg/xbox_series_x_world_premier_4k_trailer/
e9xirg,AkaYoDz,"“Omg Xbox is bad at naming things”

-typed on my IPhone 10 XL Plus",127,1576204107.0,/r/xboxone/comments/e9xirg/xbox_series_x_world_premier_4k_trailer/
e9xirg,st1tchy,">It’s backwards compatible! Across all previous Xboxes!

So I can put in Fusion Frenzy and play that? I wonder if it emulates or plays natively.",923,1576211552.0,/r/xboxone/comments/e9xirg/xbox_series_x_world_premier_4k_trailer/
e9xirg,BeerBellyBlake,"Microsoft definitely learned their lesson after the XBone reveal, huh? good to see. looking forward to more info",159,1576213231.0,/r/xboxone/comments/e9xirg/xbox_series_x_world_premier_4k_trailer/
e9xirg,,"I'm sorry Dave. 

I can't do that...",374,1576208903.0,/r/xboxone/comments/e9xirg/xbox_series_x_world_premier_4k_trailer/
e9xirg,DeathBeforeDawnn,"Furthermore, they confirmed the new Series X controller will work on Xbox One as well.",175,1576206429.0,/r/xboxone/comments/e9xirg/xbox_series_x_world_premier_4k_trailer/
e9xirg,djschxzo,the _entire_ catalog? hell. yes.,1172,1576203924.0,/r/xboxone/comments/e9xirg/xbox_series_x_world_premier_4k_trailer/
e9xirg,OSUfan88,"Looks like a bigger version of the 2013 mac pro, that can go sideways.

Love it.",171,1576204484.0,/r/xboxone/comments/e9xirg/xbox_series_x_world_premier_4k_trailer/
e9xirg,cognac-n-cannabis,thank god makes me not regret going mostly digital,84,1576204895.0,/r/xboxone/comments/e9xirg/xbox_series_x_world_premier_4k_trailer/
e9xirg,MightBeJerryWest,"Went to the gym and see this right after, completely unexpected!",497,1576204401.0,/r/xboxone/comments/e9xirg/xbox_series_x_world_premier_4k_trailer/
e9xirg,Lenlfc,Things you can say during sex and game console reveals? lol,2992,1576203560.0,/r/xboxone/comments/e9xirg/xbox_series_x_world_premier_4k_trailer/
e9xirg,Leafs17,Things are looking up.,52,1576203858.0,/r/xboxone/comments/e9xirg/xbox_series_x_world_premier_4k_trailer/
e9xirg,12temp,I was ready for a spherical console tbh,191,1576204209.0,/r/xboxone/comments/e9xirg/xbox_series_x_world_premier_4k_trailer/
e9xirg,darkdeath174,"> Yes, the box can sit both vertically and horizontally   


[https://kotaku.com/the-next-gen-xbox-is-called-xbox-series-x-1840401954](https://kotaku.com/the-next-gen-xbox-is-called-xbox-series-x-1840401954)",194,1576205142.0,/r/xboxone/comments/e9xirg/xbox_series_x_world_premier_4k_trailer/
e9xirg,wpmason,More efficient cooling at least.,59,1576203960.0,/r/xboxone/comments/e9xirg/xbox_series_x_world_premier_4k_trailer/
e9xirg,GalacticENTpire,"Actually makes a lot of sense when you consider how much heat the thing is gonna generate from all the hardware. Might as well just let it all rise through the top in a giant vent, without using too much extra plastic in the design to distribute it more horizontally.",56,1576205066.0,/r/xboxone/comments/e9xirg/xbox_series_x_world_premier_4k_trailer/
e9xirg,Cedocore,"Yeah, I kinda dig it, but... that's gonna be pretty wack for entertainment centers. Mine certainly doesn't have a spot for ""tall box"".",249,1576204523.0,/r/xboxone/comments/e9xirg/xbox_series_x_world_premier_4k_trailer/
e9xirg,ThadeousCheeks,...so the new xbox is a PC. I can dig it.,180,1576204506.0,/r/xboxone/comments/e9xirg/xbox_series_x_world_premier_4k_trailer/
e9xirg,Erock11,Yes,799,1576204033.0,/r/xboxone/comments/e9xirg/xbox_series_x_world_premier_4k_trailer/
e9xirg,Groggie,"I wonder if this will have a ""Wii U"" problem where its so similar that unfamiliar people won't know that this isn't another ""pro"" version of the Xbox One... I'm not a huge gamer, but I didn't realize this was a brand new console until I read answers to your comment.",167,1576210170.0,/r/xboxone/comments/e9xirg/xbox_series_x_world_premier_4k_trailer/
e9xirg,radix4801,Scarlett is the name for the entire generation. Anaconda and Lockhart are the consoles.,127,1576206358.0,/r/xboxone/comments/e9xirg/xbox_series_x_world_premier_4k_trailer/
e9xirg,leesfer,"Sure, but only one of those orientations will have the Xbox logo be correct",210,1576208386.0,/r/xboxone/comments/e9xirg/xbox_series_x_world_premier_4k_trailer/
e9xirg,JustSomeGoon,I’m excited but you guys gotta do better on the names.,287,1576216224.0,/r/xboxone/comments/e9xirg/xbox_series_x_world_premier_4k_trailer/
e9xirg,sakattack360,Loved it thanks. Confusion on the naming side though.,193,1576215889.0,/r/xboxone/comments/e9xirg/xbox_series_x_world_premier_4k_trailer/
e9xirg,lcg22,Its a share button,567,1576204376.0,/r/xboxone/comments/e9xirg/xbox_series_x_world_premier_4k_trailer/
e9xirg,Zenon22,"Based of the icon, something to do with downloads?",54,1576204720.0,/r/xboxone/comments/e9xirg/xbox_series_x_world_premier_4k_trailer/
e9xirg,wrongr,Amazing how they managed to keep this a secret.,468,1576203994.0,/r/xboxone/comments/e9xirg/xbox_series_x_world_premier_4k_trailer/
e9xirg,GBTheDJ,I love Grif,137,1576203870.0,/r/xboxone/comments/e9xirg/xbox_series_x_world_premier_4k_trailer/
e9xirg,Daniiiiii,Short. Stocky. Sexy. Xbox Danny DeVito.,337,1576206789.0,/r/xboxone/comments/e9xirg/xbox_series_x_world_premier_4k_trailer/
e9xirg,jhallen2260,Aren't all consoles boxes?,584,1576203581.0,/r/xboxone/comments/e9xirg/xbox_series_x_world_premier_4k_trailer/
e9xirg,Smallgenie549,Xtower,122,1576204171.0,/r/xboxone/comments/e9xirg/xbox_series_x_world_premier_4k_trailer/
e9xirg,Coletransit,Ah yes the Sex Box I always wanted,815,1576203936.0,/r/xboxone/comments/e9xirg/xbox_series_x_world_premier_4k_trailer/
e9xirg,bjki1107,"Xbox One S.

Xbox One (E)lite bundle.

Xbox One X.

Xbox Se(ries)X

It was meant to be.",127,1576205515.0,/r/xboxone/comments/e9xirg/xbox_series_x_world_premier_4k_trailer/
e9xirg,A_Kind_Shark,Should've called it the Xbox RKO,139,1576206304.0,/r/xboxone/comments/e9xirg/xbox_series_x_world_premier_4k_trailer/
e9xirg,Cliffordduhh,"Taking my boy Alan a bit out of context on this ad. Still really cool. Here’s the rest of that thought, and the whole video is worth a listen. https://youtu.be/Lz-RJXaaMW8",107,1576206757.0,/r/xboxone/comments/e9xirg/xbox_series_x_world_premier_4k_trailer/
e9xirg,waterem,Yup. Gorgeous.,57,1576211440.0,/r/xboxone/comments/e9xirg/xbox_series_x_world_premier_4k_trailer/
e9xirg,WeededDragon1,The OG Xbox One got roasted for looking like a VCR and then Microsoft comes out with the Xbox One Mini Fridge.,1352,1576203626.0,/r/xboxone/comments/e9xirg/xbox_series_x_world_premier_4k_trailer/
e9xirg,INeverPlayedF-Zero,I legitimately love it. Such a pretty obelisk.,130,1576203259.0,/r/xboxone/comments/e9xirg/xbox_series_x_world_premier_4k_trailer/
e9xirg,CaCHooKaMan,I hope it can be put on it's side because that sure as hell won't fit in my media console,162,1576203522.0,/r/xboxone/comments/e9xirg/xbox_series_x_world_premier_4k_trailer/
e9xirg,TheSpoty,"Same here, ordered the one x last week",82,1576205914.0,/r/xboxone/comments/e9xirg/xbox_series_x_world_premier_4k_trailer/
e9xirg,bseethru,Right? I've got 2 that I'm hoping will pay for the bulk of it.,81,1576204338.0,/r/xboxone/comments/e9xirg/xbox_series_x_world_premier_4k_trailer/
e9xirg,ThorsRus,Right!?!?! I was not really paying attention to the show then suddenly this happened and I was glued to the tv!,90,1576203657.0,/r/xboxone/comments/e9xirg/xbox_series_x_world_premier_4k_trailer/
e9xirg,,[deleted],182,1576203686.0,/r/xboxone/comments/e9xirg/xbox_series_x_world_premier_4k_trailer/
e9xirg,MartyrMcFly,The Xbox console names get worse every generation.,274,1576203478.0,/r/xboxone/comments/e9xirg/xbox_series_x_world_premier_4k_trailer/
e9xirg,MacDaaady,I like it from an engineering standpoint.  Heatflow will be optimal.  Exactly how I would design it.,77,1576207179.0,/r/xboxone/comments/e9xirg/xbox_series_x_world_premier_4k_trailer/
e9xirg,tills1993,Honestly looks so good. Why does everyone think it has to be the same set-top-looking-box as every other game console.,58,1576206845.0,/r/xboxone/comments/e9xirg/xbox_series_x_world_premier_4k_trailer/
e9xirg,Edgele55Placebo,"My first thought was that it looks like a really cool mini build pc.

Or one of those old ass Apple airport towers",153,1576207269.0,/r/xboxone/comments/e9xirg/xbox_series_x_world_premier_4k_trailer/
e9xirg,AlyoshaV,The Xbox SS?,81,1576210366.0,/r/xboxone/comments/e9xirg/xbox_series_x_world_premier_4k_trailer/
e9xirg,ColinZealSE,Should've named it Xbox 4x90 Degrees,53,1576204094.0,/r/xboxone/comments/e9xirg/xbox_series_x_world_premier_4k_trailer/
e9xirg,xdhpv,Lots of people will be confused because of this name.,52,1576204676.0,/r/xboxone/comments/e9xirg/xbox_series_x_world_premier_4k_trailer/
e9xirg,LaboratoryManiac,"""No.""

--Phil",209,1576204659.0,/r/xboxone/comments/e9xirg/xbox_series_x_world_premier_4k_trailer/
e9xirg,iAMA_Leb_AMA,"Xbox

Xbox 360

Xbox One

Xbox One X

Xbox Series X

how are casual parents supposed to differentiate the One X from the Series X? lol.",691,1576203749.0,/r/xboxone/comments/e9xirg/xbox_series_x_world_premier_4k_trailer/
e9xirg,EuphoricDissonance,"RIGHT!? Like 360 was unexpected but that was a good console title. Xbox One I guess was a fine name but confusing considering it was the third console. People made fun of Xbox One X for ages. Now we have Xbox Series X... which I think is going to be a wii U situation. LOADS of people didn't buy that console because they didn't even realize Wii U was different from just Wii. Now anybody not buying it for themselves gets to explain that no, the xbox series x is different from the xbox one x we already have.",94,1576203642.0,/r/xboxone/comments/e9xirg/xbox_series_x_world_premier_4k_trailer/
e9xirg,misterzadir,"well, minus the depth a PC tower.",110,1576203505.0,/r/xboxone/comments/e9xirg/xbox_series_x_world_premier_4k_trailer/
e9xirg,SharkOnGames,"It would be cool if it can PC games natively as well.    


Xbox is just a brand these days anyway.",51,1576203635.0,/r/xboxone/comments/e9xirg/xbox_series_x_world_premier_4k_trailer/
e9xirg,NotFunToday,You can on the Xbox One x. If it's like that I think it's emulation. But I have to check,224,1576212152.0,/r/xboxone/comments/e9xirg/xbox_series_x_world_premier_4k_trailer/
e9xirg,,"They said at E3 that everything already playable on xbox ones will be good to play on Series X, so yes. 

No word on if they're going to re-start adding new games to backwards compatibility though.",772,1576204141.0,/r/xboxone/comments/e9xirg/xbox_series_x_world_premier_4k_trailer/
e9xirg,Moonwatcher_2001,Oh you lift?,512,1576204947.0,/r/xboxone/comments/e9xirg/xbox_series_x_world_premier_4k_trailer/
e9xirg,plagueisthedumb,"""Aww man not another micro transaction"" every hooker I go to",590,1576204371.0,/r/xboxone/comments/e9xirg/xbox_series_x_world_premier_4k_trailer/
e9xirg,Zer0BreeZ,The Game Sphere . It’s SPHERICAL,341,1576205353.0,/r/xboxone/comments/e9xirg/xbox_series_x_world_premier_4k_trailer/
e9xirg,Ryamus,"Okama Gamesphere : ""Am I a joke to you?""",87,1576205514.0,/r/xboxone/comments/e9xirg/xbox_series_x_world_premier_4k_trailer/
e9xirg,CapnSmite,Good. I have no idea where I l'd place it on my TV stand if it had to be vertical.,97,1576206791.0,/r/xboxone/comments/e9xirg/xbox_series_x_world_premier_4k_trailer/
e9xirg,DecimalRainbow,I'm sure it can be put on its side,116,1576204990.0,/r/xboxone/comments/e9xirg/xbox_series_x_world_premier_4k_trailer/
e9xirg,KZedUK,"Apple finally kills the trash can Mac Pro

Microsoft: it’s free real estate",53,1576208051.0,/r/xboxone/comments/e9xirg/xbox_series_x_world_premier_4k_trailer/
e9xirg,T-Rextion,"I saw it and went ""so it's a pc? Cool.""",66,1576206610.0,/r/xboxone/comments/e9xirg/xbox_series_x_world_premier_4k_trailer/
e9xirg,,[deleted],640,1576205789.0,/r/xboxone/comments/e9xirg/xbox_series_x_world_premier_4k_trailer/
e9xirg,Smathers,Yeah people are calling it the anaconda now I’m so confused lol all I know is Iv been purposely avoiding the X1X cos I knew the next gen was right around the corner so it would be a waste of money for me personally. I’m totally happy with my brick Xbox one and big 1080 tv for now so when this super console comes out I’m gonna go all out and buy it with a nice 4K tv then I’ll have to figure out what to do with my old setup lol,52,1576213561.0,/r/xboxone/comments/e9xirg/xbox_series_x_world_premier_4k_trailer/
e9xirg,blaggosphere,This response raises more questions than it answers for us gaming casuals,132,1576211035.0,/r/xboxone/comments/e9xirg/xbox_series_x_world_premier_4k_trailer/
e9xirg,ZeroDrek,Unless they make it rotate.,142,1576209251.0,/r/xboxone/comments/e9xirg/xbox_series_x_world_premier_4k_trailer/
e9xirg,StockmanBaxter,"Seriously. But that is totally on brand for Microsoft.

XP, Vista, 7, 8, 10",103,1576241745.0,/r/xboxone/comments/e9xirg/xbox_series_x_world_premier_4k_trailer/
e9xirg,MajorMatt01,Imagine the number of confusing lectures kids are gonna have with their parents about which Xbox X is the on they want for Xmas,98,1576228413.0,/r/xboxone/comments/e9xirg/xbox_series_x_world_premier_4k_trailer/
e9xirg,ThatsNotRoight,"“and it also features a new Share button to make capturing screenshots and game clips simple”

https://www.google.com/amp/s/news.xbox.com/en-us/2019/12/12/microsoft-unveils-xbox-series-x/amp/

For all those wondering about the new stuff",240,1576208758.0,/r/xboxone/comments/e9xirg/xbox_series_x_world_premier_4k_trailer/
e9xirg,huskiesHTT,Ugh,350,1576205905.0,/r/xboxone/comments/e9xirg/xbox_series_x_world_premier_4k_trailer/
e9xirg,UnoriginalGinger,The article I just read on Gamespot confirmed that it’s a share button. Very cool since we lost the ability to use voice to do captures.,65,1576205256.0,/r/xboxone/comments/e9xirg/xbox_series_x_world_premier_4k_trailer/
e9xirg,ChiliManiac,"Yea, with everything leaking these days it’s amazing. I was happy to be surprised for once again.",223,1576208223.0,/r/xboxone/comments/e9xirg/xbox_series_x_world_premier_4k_trailer/
e9xirg,word2k,Geoff Ramsey > Chef Ramsay,99,1576205733.0,/r/xboxone/comments/e9xirg/xbox_series_x_world_premier_4k_trailer/
e9xirg,,No they are chip sets encased in 2 or more plastic panels.,218,1576205057.0,/r/xboxone/comments/e9xirg/xbox_series_x_world_premier_4k_trailer/
e9xirg,bseethru,Mom says it's my turn with the sex box,276,1576204211.0,/r/xboxone/comments/e9xirg/xbox_series_x_world_premier_4k_trailer/
e9xirg,lorderunion,It looks a lot like the routers Comcast gives out these days.,228,1576204295.0,/r/xboxone/comments/e9xirg/xbox_series_x_world_premier_4k_trailer/
e9xirg,,[deleted],109,1576203775.0,/r/xboxone/comments/e9xirg/xbox_series_x_world_premier_4k_trailer/
e9xirg,PurifiedVenom,I’ll be shocked if you can’t put it on the side,76,1576203761.0,/r/xboxone/comments/e9xirg/xbox_series_x_world_premier_4k_trailer/
e9xirg,,[deleted],58,1576209810.0,/r/xboxone/comments/e9xirg/xbox_series_x_world_premier_4k_trailer/
e9xirg,TekThunder,"Pretty sure it's a placeholder still. ""Series X"" seems to lead one to believe this is one of multiple versions of the console.",85,1576203642.0,/r/xboxone/comments/e9xirg/xbox_series_x_world_premier_4k_trailer/
e9xirg,FGoon,The Final Solution of the Console Question?,52,1576215248.0,/r/xboxone/comments/e9xirg/xbox_series_x_world_premier_4k_trailer/
e9xirg,SPACExCASE,Xbox Series X Iteration X Extreme X Pro X Model X One X two o'clock three o'clock four o'clock rock...X,62,1576207371.0,/r/xboxone/comments/e9xirg/xbox_series_x_world_premier_4k_trailer/
e9xirg,AkaYoDz,"Same as they did for the IPhone 6, IPhone 6s, IPhone 6s Plus or Iphone 11 pro max or The Nintendo DS, DS lite, 3DS,2DS, ‘new 3ds xl”, switch, switch lite,new switch

We have been fine",418,1576203887.0,/r/xboxone/comments/e9xirg/xbox_series_x_world_premier_4k_trailer/
e9xirg,CrazyDave48,"I'm a part of the /r/sffpc community (small form factor PC) and this style of case is semi common over there. Here is someone's from just a few days ago: https://old.reddit.com/r/sffpc/comments/e7ofpp/k39_portable_vr_rig/

The tiny cases get really expensive though because they're usually custom made or in very limited quantity because the market for them is so small.",103,1576205212.0,/r/xboxone/comments/e9xirg/xbox_series_x_world_premier_4k_trailer/
e9xirg,GraniteOverworld,"I've heard many times that Microsoft introduced backwards compatibility through software, which means it's emulation",75,1576219921.0,/r/xboxone/comments/e9xirg/xbox_series_x_world_premier_4k_trailer/
e9xirg,Gr8NonSequitur,"They LIKELY will. The BC team made an announcement that they were stopping adding new games, for the sole purpose of making sure current BC games work on Scarlet, so once that's done either they will resume making more games bc or massive layoffs. 

I'm betting on the former.",440,1576205394.0,/r/xboxone/comments/e9xirg/xbox_series_x_world_premier_4k_trailer/
e9xirg,mikesaintjules,...Bro?,293,1576205443.0,/r/xboxone/comments/e9xirg/xbox_series_x_world_premier_4k_trailer/
e9xirg,Throwaway_Apple125,"""I think I put it in the wrong slot..."" - Me everytime.",169,1576204727.0,/r/xboxone/comments/e9xirg/xbox_series_x_world_premier_4k_trailer/
e9xirg,MrDude65,SPHERICAL!!!,174,1576205848.0,/r/xboxone/comments/e9xirg/xbox_series_x_world_premier_4k_trailer/
e9xirg,sonofaresiii,"Suspend it from the ceiling in the middle of the room, so when you walk in you see a floating xbox fully illuminated directly under the light. 

As was intended",117,1576210482.0,/r/xboxone/comments/e9xirg/xbox_series_x_world_premier_4k_trailer/
e9xirg,Cedocore,"It can, but it still looks so thick, I just hope it's not too tall even sideways.",74,1576205094.0,/r/xboxone/comments/e9xirg/xbox_series_x_world_premier_4k_trailer/
e9xirg,Re-toast,That name is not gonna do them any favors to let people know that it's not just a redesign.,775,1576205971.0,/r/xboxone/comments/e9xirg/xbox_series_x_world_premier_4k_trailer/
e9xirg,Crusaruis28,Like the PS2 logo did back in the day,182,1576209732.0,/r/xboxone/comments/e9xirg/xbox_series_x_world_premier_4k_trailer/
e9xirg,Rmf16,This would be more like them naming the next version of windows “Windows series 10”,55,1576242497.0,/r/xboxone/comments/e9xirg/xbox_series_x_world_premier_4k_trailer/
